trade_date,issuer,symbol,lead_jointlead_managers,offer_price,opening_price,firstday_close,firstday_percent_pxchng,dollar_change_opening,dollar_change_close,star_ratings,performed
6/27/2013,CDW Corp,CDW,"J.P. Morgan/ Barclays/ Goldman, Sachs",17,17.68,18.37,0.08,0.68,1.37,1,
6/27/2013,HD Supply Holdings,HDS,BofA Merrill Lynch/ Barclays/ J.P. Morgan/ Credit Suisse,18.02,18.55,18.66,0.04,0.53,0.64,1,
6/27/2013,MedWorth Acquisition,MWRX,EarlyBirdCapital,8,8.01,8.01,0,0.01,0.01,1,
6/27/2013,Silvercrest Asset Management Group (SAMG),SAMG,Sandler ONeill & Partners/ Raymond James,11,11.4,11.83,0.08,0.4,0.83,1,
6/27/2013,Tremor Video,TRMR,Credit Suisse/ Jefferies,10,11,8.5,-0.15,1,-1.5,2,
6/26/2013,Luxoft Holding,LXFT,UBS Investment Bank/ Credit Suisse/ J.P. Morgan,17,18.55,20.3,0.19,1.55,3.3,2,
6/26/2013,NanoString Technologies,NSTG,J.P. Morgan/ Morgan Stanley,10,9.9,8.06,-0.19,-0.1,-1.94,1,
6/21/2013,PTC Therapeutics,PTCT,J.P. Morgan/ Credit Suisse,15,15.85,16.49,0.1,0.85,1.49,3,
6/21/2013,Gogo,GOGO,Morgan Stanley/ J .P. Morgan/ UBS Securities,17,16,16,-0.06,-1,-1,3,Missed
6/13/2013,Coty,COTY,BofA Merrill Lynch/ J.P. Morgan/ Morgan Stanley/ Barclays/ Deutsche Bank Securities/ Wells Fargo Securities,17.5,17.3,17.36,-0.01,-0.2,-0.14,3,Missed
6/12/2013,Gigamon,GIMO,"Goldman, Sachs/ BofA Merrill Lynch/ Credit Suisse",19,23.08,28.47,0.5,4.08,9.47,3,
6/7/2013,Textura,TXTR,Credit Suisse/ William Blair,15,24,20.94,0.4,9,5.94,3,
6/6/2013,"LightInTheBox Holding Co., Ltd.",LITB,Credit Suisse/ Stifel,9.5,11.16,11.61,0.22,1.66,2.11,2,
6/5/2013,RCS Capital,RCAP,JMP Securities/ Ladenburg Thalmann,20,19.75,19.78,-0.01,-0.25,-0.22,1,
5/31/2013,Epizyme,EPZM,Citigroup/ Cowen and Company/ Leerink Swann,15,20,22.99,0.53,5,7.99,2,
5/23/2013,ChannelAdvisor,ECOM,"Goldman, Sachs/ Stifel",14,17.6,18.44,0.32,3.6,4.44,3,
5/23/2013,Constellium Holdco B.V.,CSTM,"Goldman, Sachs/ Deutsche Bank Securities/ J.P. Morgan",15,13.5,14.53,-0.03,-1.5,-0.47,1,
5/23/2013,Global Brass and Copper Holdings,BRSS,"Goldman, Sachs & Co./ Morgan Stanley",11,11.75,13.55,0.23,0.75,2.55,1,
5/23/2013,Ply Gem Holdings,PGEM,"J.P. Morgan/ Credit Suisse/ Goldman, Sachs/ UBS Investment Bank/ Deutsche Bank Securities",21,22.35,23.3,0.11,1.35,2.3,3,
5/22/2013,Alcobra Ltd.,ADHD,Aegis Capital,8,8.25,7.55,-0.06,0.25,-0.45,1,
5/22/2013,Portola Pharmaceuticals,PTLA,Morgan Stanley/ Credit Suisse,14.5,15.25,15.15,0.04,0.75,0.65,2,
5/17/2013,Marketo,MKTO,"Goldman, Sachs/ Credit Suisse",13,20,23.1,0.78,7,10.1,3,
5/17/2013,Tableau Software,DATA,"Goldman, Sachs/ Morgan Stanley",31,47,50.75,0.64,16,19.75,3,
5/16/2013,Ambit Biosciences,AMBI,Citigroup/ Leerink Swann,8,8,7.39,-0.08,0,-0.61,1,
5/16/2013,William Lyon Homes,WLH,Credit Suisse/ Citigroup/ J.P. Morgan,25,27.11,25.5,0.02,2.11,0.5,2,
5/14/2013,"Tallgrass Energy Partners, LP",TEP,Barclays/ Citigroup,21.5,22,21.5,0,0.5,0,1,
5/10/2013,BioAmber,BIOAU,Credit Suisse,10,10,8.4,-0.16,0,-1.6,1,
5/10/2013,First NBC Bank Holding,NBCB,"SANDLER O’NEILL + PARTNERS/ Keefe, Bruyette & Woods (A Stifel Company )",24,25,24.5,0.02,1,0.5,2,
5/9/2013,American Residential Properties,ARPI,Morgan Stanley/ BofA Merrill Lynch/ FBR/ Jefferies,21,21,21,0,0,0,1,
5/9/2013,CYAN,CYNI,"Goldman, Sachs/ J.P. Morgan",11,10.05,11.14,0.01,-0.95,0.14,2,Missed
5/9/2013,Emerge Energy Services LP,EMES,Citigroup/ Wells Fargo Securities/ J.P. Morgan,17,16.9,16.55,-0.03,-0.1,-0.45,2,Missed
5/9/2013,PennyMac Financial Services,PFSI,"Citigroup/ BofA Merrill Lynch/ Credit Suisse/ Goldman, Sachs",18,18.25,19.1,0.06,0.25,1.1,1,
5/9/2013,Quintiles Transnational Holdings,Q,Morgan Stanley/ Barclays/ J.P. Morgan,40,43.7,42.11,0.05,3.7,2.11,3,
5/9/2013,Receptos,RCPT,Credit Suisse/ Leerink Swann/ BMO Capital Markets,14,15,14,0,1,0,1,
5/9/2013,TriState Capital Holdings,TSC,"Sandler O’Neill + Partners, L.P.",11.5,12.53,12.59,0.09,1.03,1.09,2,
5/8/2013,Armada Hoffler Properties,AHH,Baird/ Raymond James/ Stifel,11.5,11.5,11.5,0,0,0,1,
5/3/2013,QIWI plc,QIWI,J.P. Morgan/ Credit Suisse,17,17,17.08,0,0,0.08,2,Missed
5/3/2013,Harvest Capital Credit,HCAP,"Keefe, Bruyette & Woods (A Stifel Company )/ JMP Securities/ William Blair",15,15,15,0,0,0,1,
5/2/2013,ING U.S.,VOYA,"Morgan Stanley/ Goldman, Sachs/ Citigroup/ BofA Merrill Lynch/ Credit Suisse/ Deutsche Bank Securities/ J.P. Morgan",19.5,19.25,20.84,0.07,-0.25,1.34,1,
5/2/2013,Insys Therapeutics,INSY,Wells Fargo Securities/ JMP Securities,8,8.5,9.58,0.2,0.5,1.58,1,
5/1/2013,Ellington Residential Mortgage REIT,EARN,Credit Suisse/ Deutsche Bank Securities/ Citigroup/ UBS Investment Bank,20,19,19.21,-0.04,-1,-0.79,1,
4/19/2013,Blackhawk Network Holdings,HAWK,"Goldman, Sachs/ BofA Merrill Lynch/ Citigroup/ Deutsche Bank Securities",23,25,26.01,0.13,2,3.01,2,
4/19/2013,SeaWorld Entertainment,SEAS,"Goldman, Sachs/ J.P. Morgan",27,30.56,33.52,0.24,3.56,6.52,2,
4/18/2013,Hannon Armstrong Sustainable Infrastructure Capital,HASI,BofA Merrill Lynch/ UBS Investment Bank/ Wells Fargo Securities,12.5,11.6,11.4,-0.09,-0.9,-1.1,1,
4/18/2013,Intelsat S.A.,I,"Goldman, Sachs/ J.P. Morgan/ Morgan Stanley",18,17,19.25,0.07,-1,1.25,1,
4/18/2013,Taminco,TAM,"Citigroup/ Goldman, Sachs/ Credit Suisse/ J.P. Morgan/ Deutsche Bank Securities/ Jefferies/ Morgan Stanley/ UBS Investment Bank",15,14.12,14.55,-0.03,-0.88,-0.45,1,
4/16/2013,Fairway Group Holdings,FWM,Credit Suisse/ BofA Merrill Lynch/ Jefferies/ William Blair,14,18,17.35,0.24,4,3.35,3,
4/12/2013,EVERTEC,EVTC,"Goldman, Sachs/ J.P. Morgan",20,21.85,20.44,0.02,1.85,0.44,2,
4/12/2013,Rally Software Development,RALY,Deutsche Bank Securities/ Piper Jaffray,14,17.1,17.81,0.27,3.1,3.81,3,
4/11/2013,Chimerix,CMRX,Morgan Stanley/ Cowen and Company,14,15.14,18.79,0.34,1.14,4.79,1,
4/11/2013,Omthera Pharmaceuticals,OMTH,BofA Merrill Lynch/ Barclays/ Leerink Swann,8,7.4,7.43,-0.07,-0.6,-0.57,1,
4/10/2013,KNOT Offshore Partners LP,KNOP,BofA Merrill Lynch/ Citigroup,21,23,21.79,0.04,2,0.79,2,
4/10/2013,Taylor Morrison Home,TMHC,Credit Suisse/ Citigroup/ Zelman Partners,22,23.35,23.04,0.05,1.35,1.04,3,
4/5/2013,Cancer Genetics,CGIX,Aegis Capital/ Feltl and Company,10,10,11.25,0.13,0,1.25,1,
4/3/2013,Independent Bank Group,IBTX,"Sandler O'Neill & Partners/ Evercore/ Keefe, Bruyette & Woods",26,30,29.36,0.13,4,3.36,2,
3/28/2013,Pinnacle Foods,PF,"Barclays/ BofA Merrill Lynch/ Credit Suisse/ Goldman, Sachs/ Morgan Stanley/ UBS Investment Bank",20,22.26,22.21,0.11,2.26,2.21,3,
3/27/2013,Garrison Capital,GARS,Baird/ Oppenheimer,15,15,15,0,0,0,1,
3/27/2013,NV5 Holdings,NVEE.U,Roth Capital Partners,6,8,6.42,0.07,2,0.42,1,
3/22/2013,Five Oaks Investment,OAKS,"Barclays/ Credit Suisse/UBS Investment Bank/ Keefe, Bruyette & Woods ",15,14.58,14.5,-0.03,-0.42,-0.5,1,
3/22/2013,H2 Financial Management,HTWO,EarlyBirdCapital,10,10.02,10.02,0,0.02,0.02,1,
3/22/2013,Marin Software,MRIN,"Goldman, Sachs/ Deutsche Bank Securities",14,19,16.26,0.16,5,2.26,3,
3/22/2013,West Corporation,WSTC,Goldman Sachs/Morgan Stanley/JP Morgan,20,19,18.86,-0.06,-1,-1.14,1,
3/21/2013,Aviv REIT,AVIV,"Morgan Stanley/ BofA Merrill Lynch/ Goldman, Sachs",20,22.2,22.55,0.13,2.2,2.55,2,
3/21/2013,Enanta Pharmaceuticals,ENTA,J.P. Morgan/ Credit Suisse,14,14.58,17.18,0.23,0.58,3.18,2,
3/20/2013,Model N,MODN,J.P. Morgan/ Deutsche Bank Securities,15.5,20.3,19.98,0.29,4.8,4.48,3,
3/20/2013,Tetraphase Pharmaceuticals,TTPH,Barclays/ BMO Capital Markets,7,7.2,7,0,0.2,0,1,
3/13/2013,Silver Spring Networks,SSNI,"Goldman, Sachs/ Credit Suisse",17,22,22,0.29,5,5,3,
3/7/2013,Artisan Partners Asset Management,APAM,"Citigroup/ Goldman, Sachs",30,35.2,38.83,0.29,5.2,8.83,2,
3/5/2013,Professional Diversity Network,IPDN,Aegis Capital ,8,7.93,7.67,-0.04,-0.07,-0.33,1,
2/15/2013,XOOM,XOOM,Barclays/ Needham,16,21,25.49,0.59,5,9.49,3,
2/14/2013,Orchid Island Capital,ORC,Ladenburg Thalmann/ Oppenheimer,15,14.6,14.8,-0.01,-0.4,-0.2,1,
2/12/2013,ConnectOne Bancorp,CNOB,Stifel Nicolaus Weisel,28,30.5,29.65,0.06,2.5,1.65,2,
2/8/2013,Health Insurance Innovations,HIIQ,Credit Suisse/ Citigroup/ BofA Merrill Lynch,14,14.12,13.7,-0.02,0.12,-0.3,1,
2/8/2013,New Source Energy Partners L.P.,NSLP,Baird/ Stifel Nicolaus Weisel/ BMO Capital Markets/ Oppenheimer & Co.,20,20,19.49,-0.03,0,-0.51,1,
2/8/2013,ZAIS Financial,ZFC,Deutsche Bank Securities/ Citigroup/ Barclays/ Credit Suisse,21.25,20.5,19.95,-0.06,-0.75,-1.3,1,
2/6/2013,"Boise Cascade, L.L.C.,",BCC,"BofA Merrill Lynch/ Goldman, Sachs",21,25.44,26.15,0.25,4.44,5.15,3,
2/1/2013,Zoetis,ZTS,J.P. Morgan/ BofA Merrill Lynch/ Morgan Stanley,26,31.5,31.01,0.19,5.5,5.01,3,
1/31/2013,KaloBios Pharmaceuticals,KBIO,Leerink Swann,8,8.16,8,0,0.16,0,1,
1/31/2013,TRI Pointe Homes,TPH,Citigroup/ Deutsche Bank Securities/ FBR,17,19.56,19.05,0.12,2.56,2.05,3,
1/29/2013,Gladstone Land,LAND,Janney Montgomery Scott/ JMP Securities,15,15.15,15,0,0.15,0,1,
1/29/2013,Stemline Therapeutics,STML,Aegis Capital,10,11.09,11.8,0.18,1.09,1.8,1,
1/25/2013,Bright Horizons Family Solutions,BFAM,"Goldman, Sachs/ J.P. Morgan/ Barclays",22,27.75,28.32,0.29,5.75,6.32,3,
1/25/2013,LipoScience,LPDX,Barclays Capital/ UBS Investment Bank/ Piper Jaffray,9,9.75,10.45,0.16,0.75,1.45,1,
1/18/2013,CyrusOne,CONE,Morgan Stanley/ BofA Merrill Lynch,19,21.01,21.2,0.12,2.01,2.2,2,
1/18/2013,Norwegian Cruise Line Holdings,NCLH,"UBS Investment Bank/ Barclays/ Citigroup/ Deutsche Bank Securities/ Goldman, Sachs/ J.P. Morgan",19,25.1,24.79,0.3,6.1,5.79,2,
1/18/2013,"SunCoke Energy Partners, L.P.",SXCP,Barclays/ BofA Merrill Lynch/ Citigroup/ Credit Suisse/ J.P. Morgan,19,19,18.25,-0.04,0,-0.75,2,Missed
1/17/2013,"CVR Refining, LP",CVRR,Credit Suisse/ Citigroup,25,25.25,25.05,0,0.25,0.05,2,Missed
1/15/2013,"USA Compression Partners, LP",USAC,"Barclays Capital/ Goldman, Sachs/ J.P. Morgan/ Wells Fargo Securities",18,17.5,11.66,-0.35,-0.5,-6.34,1,
12/19/2012,CIS Acquisition Ltd.,CISAU,Chardan Capital Markets,10,10.01,10.03,0,0.01,0.03,1,
12/19/2012,Sprott Physical Platinum and Palladium Trust,SPPP,Morgan Stanley/ RBC Capital Markets,10,9.48,9.9,-0.01,-0.52,-0.1,1,
12/14/2012,Chart Acquisition,CACGU,Deutsche Bank Securities / Cowen and Company,10,10.01,10,0,0.01,0,1,
12/14/2012,Silver Bay Realty Trust,SBY,Credit Suisse/ BofA Merrill Lynch / J.P. Morgan,18.5,18.7,18.24,-0.01,0.2,-0.26,2,Missed
12/13/2012,PBF Energy,PBF,Citigroup/ Morgan Stanley/ Credit Suisse/ Deutsche Bank Securities,26,28,26.25,0.01,2,0.25,2,
12/13/2012,SolarCity,SCTY,"Goldman, Sachs/ Credit Suisse/ BofA Merrill Lynch",8,9.25,11.79,0.47,1.25,3.79,1,
12/7/2012,"Western Gas Equity Partners, LP",WGP,Barclays/ Citigroup/ Deutsche Bank Securities/ Morgan Stanley,22,27.18,28,0.27,5.18,6,2,
12/5/2012,WhiteHorse Finance,WHF,Deutsche Bank Securities/ J.P. Morgan/ Citigroup/ Barclays,15,14,13.9,-0.07,-1,-1.1,1,
11/21/2012,YY Inc.,YY,Morgan Stanley/ Deutsche Bank Securities/ Citigroup,10.5,10.5,11.31,0.08,0,0.81,1,
11/20/2012,"Alon USA Partners, LP",ALDW,"Goldman, Sachs/ Credit Suisse/ Citigroup",16,17,18.4,0.15,1,2.4,1,
11/16/2012,Ruckus Wireless,RKUS,"Goldman, Sachs/ Morgan Stanley",15,15,12.25,-0.18,0,-2.75,3,Missed
11/8/2012,Atossa Genetics,ATOS,Dawson James Securities,5,4.4,4.8,-0.04,-0.6,-0.2,1,
11/8/2012,OFS Capital,OFS,Morgan Stanley/ UBS Investment Bank/ Barclays/ RBC Capital Markets,15,14.64,14.35,-0.04,-0.36,-0.65,1,
11/8/2012,Stellus Capital Investment,SCM,"Raymond James/ Stifel, Nicolaus ",15,15,15.08,0.01,0,0.08,1,
11/2/2012,"Delek Logistics Partners, LP",DKL,BofA Merrill Lynch/ Barclays,21,23.11,22.35,0.06,2.11,1.35,2,
11/2/2012,Restoration Hardware Holdings,RH,"BofA Merrill Lynch/ Goldman, Sachs ",24,32.05,33.3,0.39,8.05,9.3,3,
10/26/2012,Aquasition,AQUUU,Lazard Capital Markets,10,9.95,10,0,-0.05,0,1,
10/26/2012,MPLX LP,MPLX,UBS Investment Bank/ BofA Merrill Lynch/ Morgan Stanley/ Citigroup/ J.P. Morgan,22,25.5,27.2,0.24,3.5,5.2,3,
10/26/2012,WhiteWave Foods (The),WWAV,J.P. Morgan/ Credit Suisse/ BofA Merrill Lynch,17,19,16.75,-0.01,2,-0.25,4,Missed
10/25/2012,Lehigh Gas Partners LP,LGP,Raymond James,20,21.41,20.23,0.01,1.41,0.23,2,
10/25/2012,Methes Energies International,MEILU,Paulson Investment/ Barrett & Company,5,5.08,4.86,-0.03,0.08,-0.14,1,
10/25/2012,Monroe Capital,MRCC,Baird/ William Blair/ Janney Montgomery Scott,15,14.7,15.25,0.02,-0.3,0.25,1,
10/24/2012,Collabrium Japan Acquisition (JACQU),JACQU,PrinceRidge,10,10.02,10.03,0,0.02,0.03,1,
10/19/2012,Seadrill Partners,SDLP,Citigroup/ Morgan Stanley/ Wells Fargo Securities,22,24,24.37,0.11,2,2.37,3,
10/12/2012,Diamondback Energy,FANG,Credit Suisse,17.5,17.82,17.5,0,0.32,0,2,Missed
10/12/2012,Linn Co LLC,LNCO,Barclays/ Citigroup/ RBC Capital Markets/ Wells Fargo Securities/ BofA Merrill Lynch/ Credit Suisse/ Raymond James / UBS Investment Bank,36.5,36.78,38.26,0.05,0.28,1.76,1,
10/12/2012,Workday,WDAY,"Morgan Stanley/ Goldman, Sachs",28,48.05,48.69,0.74,20.05,20.69,3,
10/11/2012,Intercept Pharmaceuticals,ICPT,BofA Merrill Lynch,15,19.4,20.4,0.36,4.4,5.4,1,
10/11/2012,KYTHERA Biopharmaceuticals,KYTH,"J.P. Morgan/ Goldman, Sachs",16,18.49,19.79,0.24,2.49,3.79,1,
10/11/2012,Realogy Holdings,RLGY,"Goldman, Sachs/ J.P. Morgan/ Barclays/ Credit Suisse",27,32.85,34.2,0.27,5.85,7.2,2,
10/11/2012,Shutterstock,SSTK,Morgan Stanley/ Deutsche Bank Securities/ Jefferies,17,22.5,21.66,0.27,5.5,4.66,3,
10/10/2012,Ambarella,AMBA,Morgan Stanley/ Deutsche Bank Securities,6,6.71,6.06,0.01,0.71,0.06,1,
10/10/2012,Amira Nature Foods,ANFI,UBS Investment Bank/ Deutsche Bank Securities,10,10,9.58,-0.04,0,-0.42,1,
10/5/2012,FleetMatics Group plc,FLTX,BofA Merrill Lynch/ Barclays,17,22.95,22.3,0.31,5.95,5.3,3,
10/4/2012,Berry Plastics Group,BERY,BofA Merrill Lynch/ Citigroup/ Barclays/ Deutsche Bank Securities,16,15.25,15.2,-0.05,-0.75,-0.8,1,
10/4/2012,Regulus Therapeutics,RGLS,Lazard Capital Markets/ Cowen and Company/ BMO Capital Markets,4,4.73,4.2,0.05,0.73,0.2,1,
10/3/2012,JAVELIN Mortgage Investment,JMI,Deutsche Bank Securities/ Citigroup/ Barclays/ Credit Suisse,20,19.75,19.6,-0.02,-0.25,-0.4,1,
10/3/2012,LifeLock,LOCK,"Goldman, Sachs/ BofA Merrill Lynch/ Deutsche Bank Securities",9,8.38,8.36,-0.07,-0.62,-0.64,2,Missed
10/3/2012,Luxfer Holdings PLC,LXFR,Credit Suisse/ Jefferies,10,11,11.06,0.11,1,1.06,1,
9/28/2012,Qualys,QLYS,J.P. Morgan/ Credit Suisse,12,12,14.16,0.18,0,2.16,3,
9/28/2012,"Summit Midstream Partners, LP",SMLP,"Barclays/ BofA Merrill Lynch/ Goldman, Sachs/ Morgan Stanley",20,21,21.11,0.06,1,1.11,2,
9/26/2012,Santander México Financial Group,BSMX,UBS Investment Bank/ Duetsche Bank/ BofA Merrill Lynch,12.18,12.6,12.91,0.06,0.42,0.73,2,
9/20/2012,National Bank Holdings,NBHC,"Goldman, Sachs/ Keefe, Bruyette & Woods",19.25,20.25,19.6,0.02,1,0.35,1,
9/20/2012,Spirit Realty Capital,SRC,Morgan Stanley,15,15,15,0,0,0,1,
9/20/2012,Susser Petroleum Partners LP,SUSP,BofA Merrill Lynch/ Barclays/ Wells Fargo Securities/ UBS Investment Bank,20.5,23.4,22.91,0.12,2.9,2.41,2,
9/20/2012,Trulia,TRLA,J.P. Morgan/ Deutsche Bank Securities,17,22.1,24,0.41,5.1,7,3,
8/16/2012,Hi-Crush Partners LP,HCLP,Barclays/ Morgan Stanley/ Credit Suisse/ UBS Investment Bank,17,17,20,0.18,0,3,1,
8/10/2012,Manchester United Ltd.,MANU,Jefferies/ Credit Suisse/ J.P. Morgan/ BofA Merrill Lynch/ Deutsche Bank Securities,14,14.05,14,0,0.05,0,1,
8/10/2012,Performant Financial,PFMT,"Morgan Stanley/ Goldman, Sachs/ Credit Suisse/ Wells Fargo Securities",9,9.25,10.6,0.18,0.25,1.6,1,
8/8/2012,Bloomin Brands,BLMN,"BofA Merrill Lynch/ Morgan Stanley/ J.P. Morgan/ Deutsche Bank Securities/ Goldman, Sachs",11,11.6,12.41,0.13,0.6,1.41,1,
8/8/2012,Peregrine Semiconductor,PSMI,Deutsche Bank Securities/ J.P. Morgan,14,15,14.71,0.05,1,0.71,1,
8/2/2012,Eloqua Limited,ELOQ,J.P. Morgan/ Deutsche Bank Securities,11.5,12,12.89,0.12,0.5,1.39,3,
8/2/2012,Hyde Park Acquisition Corp. II,HPAC,Deutsche Bank Securities,10,10,10.03,0,0,0.03,1,
7/27/2012,AmREIT,AMRE,Jefferies/ Baird,14,14,14.02,0,0,0.02,1,
7/27/2012,Del Friscos Restaurant Group,DGRG,Deutsche Bank Securities/ Piper Jaffray/ Wells Fargo Securities,13,12.75,13,0,-0.25,0,1,
7/26/2012,E2open,EOPN,BofA Merrill Lynch,15,14.14,13.6,-0.09,-0.86,-1.4,2,Missed
7/26/2012,Hyperion Therapeutics,HPTX,Leerink Swann/ Cowen,10,10.31,10.11,0.01,0.31,0.11,1,
7/26/2012,Northern Tier Energy,NTI,"Goldman, Sachs/ Barclays/ BofA Merrill Lynch",14,13.66,14.16,0.01,-0.34,0.16,1,
7/25/2012,Natural Grocers by Vitamin Cottage,NGVC,SunTrust Robinson Humphrey/ Piper Jaffray,15,18,17.86,0.19,3,2.86,2,
7/24/2012,Chuy's Holdings,CHUY,Jefferies/ Baird,13,15,15.06,0.16,2,2.06,2,
7/20/2012,Infinity Cross Border Acquisition,INXBU,EarlyBirdCapital,8,8.01,8.01,0,0.01,0.01,1,
7/20/2012,KAYAK Software,KYAK,Morgan Stanley/ Deutsche Bank Securities,26,30.1,33.18,0.28,4.1,7.18,3,
7/20/2012,Palo Alto Networks,PANW,"Morgan Stanley/ Goldman, Sachs/ Citigroup",42,55.15,53.13,0.27,13.15,11.13,3,
7/19/2012,Durata Therapeutics,DRTX,BofA Merrill Lynch/ Credit Suisse,9,10,9.04,0,1,0.04,1,
7/19/2012,Five Below,FIVE,"Goldman, Sachs/ Barclays/ Jefferies",17,26.05,26.5,0.56,9.05,9.5,3,
6/29/2012,ServiceNow,NOW,Morgan Stanley/ Citigroup/ Deutsche Bank Securities,18,23.75,24.6,0.37,5.75,6.6,3,
6/28/2012,TESARO,TSRO,Citigroup/ Morgan Stanley/ Leerink Swann,13,14,13.69,0.05,1,0.69,1,
6/28/2012,Exa Corporation,EXA,Stifel Nicolaus Weisel,10,10,9.98,0,0,-0.02,1,
6/27/2012,"EQT Midstream Partners, LP",EQM,Citigroup/ Barclays,21,23,23.75,0.13,2,2.75,2,
5/18/2012,Facebook,FB,"Morgan Stanley/ J.P. Morgan/ Goldman, Sachs",38,42,38.23,0.01,4,0.23,4,
5/11/2012,Edwards Group,EVAC,Jefferies/ Morgan Stanley/ Citigroup,8,8.12,8.75,0.09,0.12,0.75,1,
5/11/2012,Ignite Restaurant Group,IRG,Credit Suisse/ Bair/ Piper Jaffray,14,16.75,17.13,0.22,2.75,3.13,3,
5/10/2012,Audience,ADNC,J.P. Morgan/ Credit Suisse/ Deutsche Bank Securities,17,19,19,0.12,2,2,3,
5/10/2012,WageWorks,WAGE,William Blair & Company/ Stifel Nicolaus Weisel,9,9.99,9.99,0.11,0.99,0.99,1,
5/10/2012,Western Asset Management Capital,WMC,Deutsche Bank Securities/ J.P. Morgan/ Citigroup/ Jefferies,20,18.8,18.8,-0.06,-1.2,-1.2,1,
5/4/2012,PetroLogistics LP,PDH,Morgan Stanley/ Citigroup/ UBS Investment Bank,17,16.5,16.5,-0.03,-0.5,-0.5,1,
5/4/2012,Tillys,TLYS,"Goldman, Sachs/ BofA Merrill Lynch/ Piper Jaffray",15.5,18.8,16.81,0.08,3.3,1.31,3,
5/3/2012,Pacific Coast Oil Trust,ROYT,Barclays/ Citigroup/ BofA Merrill Lynch/ J.P. Morgan/ UBS Investment Bank/ Wells Fargo Securities,20,20,20,0,0,0,1,
5/1/2012,Supernus Pharmaceuticals,SUPN,Citigroup/ Piper Jaffray,5,6.5,5.37,0.07,1.5,0.37,1,
4/27/2012,Edgen Group,EDG,Jefferies/ Morgan Stanley/ Citigroup,11,10.35,9.5,-0.14,-0.65,-1.5,1,
4/26/2012,Ares Commercial Real Estate,ACRE,Wells Fargo Securities/ Citigroup/ BofA Merrill Lynch/ J.P. Morgan,18.5,18.13,18,-0.03,-0.37,-0.5,1,
4/25/2012,ClearSign,CLIR,MDB Capital Group LLC,4,4.11,4.2,0.05,0.11,0.2,1,
4/25/2012,Envivio,ENVI,"Goldman, Sachs/ Deutsche Bank Securities/ Stifel Nicolaus Weisel",9,9.35,8.49,-0.06,0.35,-0.51,2,Missed
4/20/2012,Infoblox,BLOX,"Morgan Stanley/ Goldman, Sachs/ UBS Securities",16,22.5,21.3,0.33,6.5,5.3,3,
4/20/2012,Midstates Petroleum,MPO,"Goldman, Sachs/ Morgan Stanley/ Wells Fargo Securities",13,13.25,15.03,0.16,0.25,2.03,1,
4/20/2012,Proofpoint,PFPT,Credit Suisse/ Deutsche Bank Securities,13,16.85,14.05,0.08,3.85,1.05,3,
4/19/2012,Splunk,SPLK,Morgan Stanley/ Credit Suisse/ J.P. Morgan/ BofA Merrill Lynch,17,32,35.48,1.09,15,18.48,3,
4/19/2012,Tumi Holdings,TUMI,"Goldman, Sachs/ Credit Suisse/ J.P. Morgan",18,26,26.5,0.47,8,8.5,3,
4/18/2012,SandRidge Mississippian Trust II,SDR,Morgan Stanley/ Raymond James,21,21.8,21.4,0.02,0.8,0.4,1,
4/17/2012,Digital Cinema Destinations,DCIN,Maxim Group/ Dominick & Dominick,6.1,5.9,6.17,0.01,-0.2,0.07,1,
4/12/2012,Forum Energy Technologies,FET,J.P. Morgan/BofA Merrill Lynch/ Credit Suisse/ Citigroup/ Deutsche Bank Securities,20,22.5,21.75,0.09,2.5,1.75,2,
4/12/2012,MRC Global,MRC,"Goldman, Sachs/ Barclays ",21,20.5,21.04,0,-0.5,0.04,2,Missed
4/12/2012,Oaktree Capital Group,OAK,"Goldman, Sachs/ Morgan Stanley",43,41,42.39,-0.01,-2,-0.61,1,
4/5/2012,Retail Properties of America,RPAI,J.P. Morgan/ Citigroup/ Deutsche Bank Securities/ KeyBanc Capital Markets,8,8.78,8.75,0.09,0.78,0.75,1,
4/4/2012,TCP Capital,TCPC,Deutsche Bank Securities/ Stifel Nicolaus Weisel,14.75,14.25,14.55,-0.01,-0.5,-0.2,1,
3/30/2012,Enphase Energy,ENPH,Morgan Stanley/ BofA Merrill Lynch/ Deutsche Bank Securities,6,7.5,7.34,0.22,1.5,1.34,1,
3/30/2012,GasLog Ltd.,GLOG,"Goldman, Sachs/ Citigroup",14,12.5,12.41,-0.11,-1.5,-1.59,1,
3/29/2012,CafePress,PRSS,J.P. Morgan/ Jefferies,19,21.1,19.03,0,2.1,0.03,2,
3/29/2012,Merrimack Pharmaceuticals,MACK,J.P. Morgan,7,6.16,6.04,-0.14,-0.84,-0.96,1,
3/29/2012,Millennial Media,MM,"Morgan Stanley/ Goldman, Sachs/ Barclays Capital",13,25,25,0.92,12,12,3,
3/29/2012,Rexnord,RXN,"BofA Merrill Lynch/ Goldman, Sachs/ Credit Suisse/ Deutsche Bank Securities/ Barclays Capital",18,19.05,20,0.11,1.05,2,2,
3/28/2012,Annie’s,BNNY,Credit Suisse/ J.P. Morgan,19,31.11,35.92,0.89,12.11,16.92,3,
3/28/2012,Regional Management,RM,Jefferies/ Stephens,15,17,16.45,0.1,2,1.45,1,
3/28/2012,Vocera Communications,VCRA,J.P. Morgan/ Piper Jaffray,19,24,21.03,0.11,5,2.03,2,
3/23/2012,Vipshop Holdings,VIPS,Goldman Sachs (Asia)/ Deutsche Bank Securities,6.5,6,5.5,-0.15,-0.5,-1,1,
3/23/2012,Whiting USA Trust II,WHZ,Raymond James/ Morgan Stanley,20,21,24.46,0.22,1,4.46,1,Missed
3/22/2012,CaesarStone Sdot-Yam Ltd.,CSTE,J.P. Morgan/ Barclays Capital/ Credit Suisse,11,10.99,11.11,0.01,-0.01,0.11,1,
3/22/2012,ExactTarget,ET,"J.P. Morgan/ Deutsche Bank Secutities/ Stifel, Nicolaus Weisel",19,23.05,25.11,0.32,4.05,6.11,3,
3/22/2012,Vantiv,VNTV,"J.P. Morgan/ Morgan Stanley/ Credit Suisse/ Goldman, Sachs & Co./ Deutsche Bank Securities",17,19,19.5,0.15,2,2.5,2,
3/21/2012,BGS Acquisition,BGSCU,PrinceRidge/ Mitsubishi UFJ Securities,10,9.94,9.87,-0.01,-0.06,-0.13,1,
3/15/2012,Allison Transmission Holdings,ALSN,"BofA Merrill Lynch/ Citi/ J.P. Morgan/ Credit Suisse/ Morgan Stanley/ Goldman, Sachs & Co.",23,23,23.4,0.02,0,0.4,1,
3/15/2012,Demandware,DWRE,"Goldman, Sachs/ Deutsche Bank Securities",16,25.25,23.85,0.49,9.25,7.85,3,
3/15/2012,M/A-COM Technology Solutions Holdings,MTSI,Barclays Capital/ J.P. Morgan/ Jefferies,19,19.1,20.55,0.08,0.1,1.55,2,
3/8/2012,Nationstar Mortgage Holdings,NSM,BofA Merrill Lynch/Citigroup/ Credit Suisse/ Wells Fargo Securities,14,13.57,14.25,0.02,-0.43,0.25,1,
3/2/2012,Yelp!,YELP,"Goldman, Sachs/ Citigroup/ Jefferies",15,22.01,24.58,0.64,7.01,9.58,3,
2/29/2012,Home Loan Servicing Solutions,HLSS,Wells Fargo Securities/ Barclays Capital/ Citigroup/ Deutsche Bank Securities,14,13.25,13.56,-0.03,-0.75,-0.44,1,
2/24/2012,Proto Labs,PRLB,Jefferies/ Piper Jaffray,16,25,29,0.81,9,13,3,
2/21/2012,Ceres,CERE,"Goldman, Sachs/ Barclays Capital",13,14.8,14.8,0.14,1.8,1.8,1,
2/17/2012,Brightcove,BCOV,"Morgan Stanley/ Stifel, Nicolaus Weisel",11,14.5,14.3,0.3,3.5,3.3,2,
2/10/2012,GSE Holding,GSE,Oppenheimer & Co./ William Blair & Company/ FBR,9,10.3,11.5,0.28,1.3,2.5,1,
2/10/2012,HomeStreet,HMST,FBR Capital Markets,44,47.51,48,0.09,3.51,4,2,
2/10/2012,Synacor,SYNC,BofA Merrill Lynch/ Citigroup/ Stifel Nicolaus Weisel,5,5.75,5.25,0.05,0.75,0.25,1,
2/9/2012,FX Alliance,FX,"BofA Merrill Lynch/ Goldman, Sachs/ Citigroup/ J.P. Morgan",12,13.6,13.74,0.15,1.6,1.74,1,
2/8/2012,Caesars Entertainment,CZR,Credit Suisse/ Citigroup/ BofA Merrill Lynch/ Deutsche Bank Securities,9,9.06,15.39,0.71,0.06,6.39,1,
2/8/2012,ChemoCentryx,CCXI,J.P. Morgan/ Citigroup,10,10.33,11,0.1,0.33,1,1,
2/8/2012,EPAM Systems,EPAM,Citigroup/ UBS Investment Bank/ Barclays Capital/ RenCap,12,13.75,14,0.17,1.75,2,1,
2/8/2012,Roundys Parent,RNDY,Credit Suisse/ J.P. Morgan/ Jefferies/ Baird,8.5,8.4,9,0.06,-0.1,0.5,2,
2/3/2012,Cempra Holdings,CEMP,Stifel Nicolaus Weisel/ Leerink Swann/ Cowen and Company,6,6.18,6.06,0.01,0.18,0.06,1,
2/2/2012,AVG Technologies N.V.,AVG,"Morgan Stanley/ J.P. Morgan/ Goldman, Sachs",16,13.53,13,-0.19,-2.47,-3,3,Missed
2/2/2012,Greenway Medical Technologies,GWAY,J.P. Morgan/ Morgan Stanley/ William Blair,10,10.1,13,0.3,0.1,3,2,
2/2/2012,Matador Resources,MTDR,RBC Capital Markets/ Citigroup,12,11.75,11.75,-0.02,-0.25,-0.25,1,
2/1/2012,U.S. Silica Holdings,SLCA,Morgan Stanley/ BofA Merrill Lynch/ Jefferies,17,17.25,16,-0.06,0.25,-1,2,Missed
1/27/2012,Verastem,VSTM,UBS Investment Bank/ Leerink Swann,10,11,11.09,0.11,1,1.09,1,Missed
1/25/2012,Guidewire Software,GWRE,J.P. Morgan/ Deutsche Bank Securities/ Citigroup,13,16.75,17.12,0.32,3.75,4.12,3,
1/19/2012,Renewable Energy Group,REGI,UBS Investment Bank/ Piper Jaffray,10,10.1,10.1,0.01,0.1,0.1,1,
12/16/2011,"Inergy Midstream, L.P.",NRGM,Morgan Stanley/ Barclays Capital/ BofA Merrill Lynch/ Credit Suisse/ Wells Fargo Securities,17,17,17.65,0.04,0,0.65,1,
12/16/2011,Zynga,ZNGA,"Morgan Stanley/ Goldman, Sachs",10,11,9.5,-0.05,1,-0.5,3,
12/15/2011,Bonanza Creek Energy,BCEI,Morgan Stanley/ Credit Suisse,17,15.5,13.61,-0.2,-1.5,-3.39,1,
12/15/2011,Laredo Petroleum Holdings,LPI,J.P. Morgan,17,17.25,18.1,0.06,0.25,1.1,1,
12/15/2011,Michael Kors Holdings,KORS,"Morgan Stanley/ J.P. Morgan/ Goldman, Sachs & Co.",20,25,24.2,0.21,5,4.2,3,
12/15/2011,"Mid-Con Energy Partners, LP",MCEP,RBC Capital Markets,18,17.72,18.05,0,-0.28,0.05,1,
12/14/2011,Sanchez Energy,SN,Johnson Rice & Company/ Macquarie Capital,22,20,18.25,-0.17,-2,-3.75,1,
12/13/2011,Jive Software,JIVE,"Morgan Stanley/ Goldman, Sachs",12,15.12,15.05,0.25,3.12,3.05,3,
12/9/2011,Memorial Production Partners LP,MEMP,Citigroup/ Raymond James/ Wells Fargo Securities,19,18.82,19.79,0.04,-0.18,0.79,1,
12/9/2011,"Rose Rock Midstream, L.P.",RRMS,Barclays Capital/ Citigroup/ Deutsche Bank Securities,20,20.5,20,0,0.5,0,2,
12/2/2011,Vanguard Energy,VNGEU,Paulson Investment,1,1.15,1.15,0.15,0.15,0.15,1,
11/23/2011,BlackRock Utility & Infrastructure Trust (BUI),BUI,Morgan Stanley/ Citigroup/ BofA Merrill Lynch/ UBS Investment Bank/ Wells Fargo Securities/ Ameriprise Financial Services/ RBC Capital Markets,20,20,20,0,0,0,1,
11/18/2011,Digital Domain Media Group,DDMG,Roth Capital Partners,8.5,8.5,7.15,-0.16,0,-1.35,1,
