trade_date,issuer,symbol,lead_jointlead_managers,offer_price,opening_price,firstday_close,firstday_percent_pxchng,dollar_change_opening,dollar_change_close,star_ratings,performed
9/11/2020,Broadstone Acquisition,BSN.U,Citigroup,10,9.84,9.6,-0.04,-0.16,-0.4,1,
9/11/2020,Ribbit LEAP,LEAP.U,JPMorgan,10,11.2,11.55,0.16,1.2,1.55,1,Missed
9/11/2020,Tortoise Acquisition Corp. II,SNPR.U,Barclays/ Goldman Sachs,10,10.35,10.51,0.05,0.35,0.51,1,
9/11/2020,TWC Tech Holdings II,TWCTU,Citigroup/ Deutsche Bank Securities,10,10.08,10.07,0.01,0.08,0.07,1,
9/10/2020,NavSight Holdings,NSH.U,Credit Suisse,10,10,10,0,0,0,1,
9/10/2020,Prime Impact Acquisition I,PIAI.U,Goldman Sachs/ BofA Securities,10,10,10,0,0,0,1,
9/10/2020,Starboard Value Acquisition,SVACU,UBS Investment Bank/ Stifel/ Cowen,10,10,10,0,0,0,1,
9/9/2020,Cohn Robbins Holdings,CRHCU,Credit Suisse,10,10.1,10.01,0,0.1,0.01,1,
9/9/2020,Industrial Tech Acquisitions,ITACU,Maxim Group,10,9.92,9.97,0,-0.08,-0.03,1,
9/3/2020,BCTG Acquisition,BCTG,SVB Leerink,10,9.85,10.28,0.03,-0.15,0.28,1,
9/2/2020,CM Life Sciences,CNLFU,Jefferies,10,10.07,10.25,0.03,0.07,0.25,1,
9/2/2020,INSU Acquisition Corp. II,INAQU,Cantor,10,10.2,10.26,0.03,0.2,0.26,1,
9/2/2020,HighCape Capital Acquisition,CAPAU,Cantor,10,10.11,10.15,0.02,0.11,0.15,1,
9/2/2020,Tailwind Acquisition,TWND.U,Jefferies,10,10,10,0,0,0,1,
9/1/2020,PainReform,PRFX,Maxim Group/ Joseph Gunnar,8,7.75,6.74,-0.16,-0.25,-1.26,1,
8/31/2020,Applied UV,AUVI,"Network 1 Financial Securities,",5,5.75,11.6,1.32,0.75,6.6,0,
8/28/2020,Harbor Custom Development,HCDI,ThinkEquity (a division of Fordham Financial Management),6,5.5,7.5,0.25,-0.5,1.5,1,
8/27/2020,Burgundy Technology Acquisition,BTAQU,Mizuho Securities,10,10,9.98,0,0,-0.02,1,
8/27/2020,CF Finance Acquisition Corp II (CFIIU) (u),CFIIU,Cantor,10,10,9.94,-0.01,0,-0.06,1,
8/27/2020,XPeng,XPEV,Credit Suisse/ J.P. Morgan/ BofA Securities,15,23.1,21.22,0.41,8.1,6.22,3,
8/26/2020,FTAC Olympus Acquisition,FTOCU,Citigroup/ Cantor,10,9.93,9.93,-0.01,-0.07,-0.07,1,
8/21/2020,Colonnade Acquisition,CLA.U,BTIG,10,9.95,9.92,-0.01,-0.05,-0.08,1,
8/21/2020,FAST Acquisition,FST.U,Citigroup/ UBS Investment Bank,10,9.96,9.93,-0.01,-0.04,-0.07,1,
8/21/2020,Foley Trasimene Acquisition II,BFT.U,Credit Suisse/ BofA Securities,10,10.01,10,0,0.01,0,1,
8/21/2020,Forum Merger III .,FIII.U,Jefferies,10,10,10,0,0,0,1,
8/21/2020,Horizon Acquisition,HZAC.U,Credit Suisse,10,10,10,0,0,0,1,
8/21/2020,Kymera Therapeutics,KYMR,Morgan Stanley/ BofA Securities/ Cowen/ Guggenheim Securities,20,35,33.26,0.66,15,13.26,3,
8/21/2020,Nano-X Imaging,NNOX,Cantor/ Oppenheimer/ Berenberg/ CIBC Capital Markets,18,20.34,21.7,0.21,2.34,3.7,3,
8/19/2020,Harmony Biosciences Holdings,HRMY,Goldman Sachs/ Jefferies/ Piper Sandle,24,39.99,37.01,0.54,15.99,13.01,3,
8/19/2020,Inhibrx,IBNX,Jefferies/ Evercore ISI/ Credit Suisse,17,22.1,20.63,0.21,5.1,3.63,2,
8/18/2020,Northern Genesis Acquisition,NGA.U,Raymond James/ EarlyBirdCapita,10,10,10,0,0,0,1,
8/18/2020,one,AONE.U,Goldman Sachs,10,10.15,10.1,0.01,0.15,0.1,1,
8/18/2020,Star Peak Energy Transition,STPK.U,Credit Suisse/ Goldman Sachs,10,10.01,10,0,0.01,0,1,
8/14/2020,RedBall Acquisition,RBAC.U,Goldman Sachs,10,10.25,10.16,0.02,0.25,0.16,1,
8/14/2020,CureVac N.V.,CVAC,BofA Securities/ Jefferies/ Credit Suisse,16,44,55.9,2.49,28,39.9,2,Missed
8/14/2020,dMY Technology Group,DYM.U,UBS Investment Bank,10,10.05,10.1,0.01,0.05,0.1,1,
8/14/2020,Dragoneer Growth Opportunities,DGNR.U,Citigroup/ Goldman Sachs/ J.P. Morgan,10,10.6,10.68,0.07,0.6,0.68,1,
8/14/2020,Lionheart Acquisition Corp. II,LCAPU,Nomura/ Cantor,10,9.99,9.97,0,-0.01,-0.03,1,
8/13/2020,FS Development,FSDC,Jefferies,10,10.25,10.3,0.03,0.25,0.3,1,
8/13/2020,KE Holdings,BEKE,Goldman Sachs/ Morgan Stanley/ China Renaissance,20,35.06,37.44,0.87,15.06,17.44,3,
8/13/2020,NetSTREIT Corp.,NTST,Wells Fargo Securities/ BofA Securities/ Citigroup/ Stifel/ Jefferies,18,18,17.7,-0.02,0,-0.3,1,
8/12/2020,Fortress Value Acquisition Corp. II (FAII.U) (u),FAII.U,Deutsche Bank Securities/ Morgan Stanley/ BofA Securities,10,10.12,10.17,0.02,0.12,0.17,1,
8/12/2020,Kubient,KBNT/KBnth,Maxim Group/ Joseph Gunnar,5,5,5.07,0.01,0,0.07,1,
8/7/2020,ARYA Sciences Acquisition Corp III,ARYA,Jefferies/ Goldman Sachs,10,10.5,10.44,0.04,0.5,0.44,1,
8/7/2020,Checkmate Pharmaceuticals,CMPI,BofA Securities/ Jefferies/ BMO Capital Markets,15,14.5,14,-0.07,-0.5,-1,3,Missed
8/7/2020,Freeline Therapeutics Holdings plc,FRLN,J.P. Morgan/ Morgan Stanley/ Evercore ISI,18,18.5,18,0,0.5,0,2,
8/7/2020,IBEX Ltd.,IBEX,Citigroup/ RBC Capital Markets/ Baird,19,18,15.4,-0.19,-1,-3.6,1,
8/7/2020,Vistas Media Acquisition,VMACU, I-Bankers Securities,10,9.95,9.95,-0.01,-0.05,-0.05,1,
8/6/2020,Gores Holdings V,GRSVU,Deutsche Bank Securities/ Morgan Stanley,10,10.06,10.08,0.01,0.06,0.08,1,
8/6/2020,Kismet Acquisition One,KSMTU,Credit Suisse/ BofA Securities,10,10,9.98,0,0,-0.02,1,
8/6/2020,Acutus Medical,AFIB,J.P. Morgan/ BofA Securities/ William Blair,18,24.11,26.5,0.47,6.11,8.5,2,Missed
8/6/2020,Oak Street Health,OSH,J.P. Morgan/ Goldman Sachs/ Morgan Stanley,21,42.5,40,0.9,21.5,19,3,
8/6/2020,Rocket Companies,RKT,Goldman Sachs/ Morgan Stanley/ Credit Suisse/ J.P. Morgan RBC Capital Markets,18,18,21.51,0.2,0,3.51,1,
8/5/2020,BigCommerce Holdings,BIGC,Morgan Stanley/ Barclays/ Jefferies/ KeyBanc Capital Markets,24,68,72.27,2.01,44,48.27,3,
8/5/2020,Rackspace Technology,RXT,Goldman Sachs/ Citigroup/ JPMorgan,21,16.85,16.39,-0.22,-4.15,-4.61,2,Missed
8/5/2020,GO Acquisition,GOAC.U,Credit Suisse,10,10,10,0,0,0,1,
8/5/2020,BowX Acquisition,BOWXU,UBS Investment Bank,10,10.02,10.03,0,0.02,0.03,1,
8/5/2020,Holicity,HOLUU,Deutsche Bank Securities/ BofA Securities,10,10.01,10.01,0,0.01,0.01,1,
8/4/2020,Health Sciences Acquisitions Corp 2,HSAQ,Chardan/ Barclays,10,11.41,11.4,0.14,1.41,1.4,1,Missed
8/4/2020,Yucaipa Acquisition,"YAC,U",Citigroup,10,10.02,10.01,0,0.02,0.01,1,
7/31/2020,1847 Goedeker,GOED,ThinkEquity (a division of Fordham Financial Management),9,9.4,8.9,-0.01,0.4,-0.1,1,
7/31/2020,NewHold Investment,NHICU,Stifel,10,9.92,9.91,-0.01,-0.08,-0.09,1,
7/31/2020,E.Merge Technology Acquisition,ETACU,Cantor/ Mizuho Securities,10,10.05,10,0,0.05,0,1,
7/31/2020,Fathom Holdings,FTHM,Roth Capital Partners,10,11.5,10.03,0,1.5,0.03,2,
7/31/2020,CC Neuberger Principal Holdings II,PRPB.U,Credit Suisse. Citigroup/ Morgan Stanley,10,10.15,10.07,0.01,0.15,0.07,1,
7/31/2020,Vital Farms,VITL,Goldman Sachs/ Morgan Stanley/ Credit Suisse,22,35,35.26,0.6,13,13.26,3,
7/30/2020,AlloVir,ALVR,Morgan Stanley/ J.P. Morgan/ SVB Leerink/ Piper Sandler,17,20,25.39,0.49,3,8.39,2,
7/30/2020,Churchill Capital Corp IV,CCIV.U,Citigroup,10,10.06,10,0,0.06,0,1,
7/30/2020,Li Auto,LI,Goldman Sachs (Asia)/ Morgan Stanley/ UBS Investment Bank/ CICC,11.5,15.5,16.46,0.43,4,4.96,3,
7/29/2020,Vertex,VERX,Goldman Sachs/ Morgan Stanley,19,25.56,23.93,0.26,6.56,4.93,3,
7/28/2020,ACE Convergence Acquisition,ACEVU,Cantor,10,10.2,10.24,0.02,0.2,0.24,1,
7/24/2020,Annexon,ANNX,J.P. Morgan/ BofA Securities/ Cowen,17,17.4,17.76,0.04,0.4,0.76,3,Missed
7/24/2020,Ascendant Digital Acquisition,ACND.U,UBS Investment Bank,10,10.3,10.31,0.03,0.3,0.31,1,
7/24/2020,Greencity Acquisition,GRCYU,Ladenburg Thalmann,10,9.95,10,0,-0.05,0,1,
7/24/2020,Inozyme Pharma,INZY,BofA Securities/ Cowen/ Piper Sandler,18,20.8,17.54,-0.03,2.8,-0.46,3,
7/24/2020,iTeos Therapeutics,ITOS,J.P. Morgan/ SVB Leerink/ Piper Sandler,19,25.55,19.05,0,6.55,0.05,3,
7/24/2020,Nurix Therapeutics,NRIX,J.P. Morgan/ Piper Sandler/ Stifel,19,18.06,19.01,0,-0.94,0.01,3,Missed
7/23/2020,East Resources Acquisition,ERESU,Wells Fargo Securities,10,9.96,10,0,-0.04,0,1,
7/23/2020,Montrose Environmental Group,MEG,BofA Securities/ William Blair,15,16.5,22,0.47,1.5,7,1,Missed
7/23/2020,Skillful Craftsman Education Technology,EDTK,"The Benchmark Company/ Axiom Capital Management,",5,5.35,4.75,-0.05,0.35,-0.25,0,
7/22/2020,Jamf Holding,JAMF,Goldman Sachs/ J.P. Morgan/ BofA Securities/ Barclays,26,46,39.2,0.51,20,13.2,3,
7/22/2020,Pershing Square Tontine Holdings,PTH.U,Citigroup/ Jefferies/ UBS Investment Bank,20,21.15,21.3,0.07,1.15,1.3,2,
7/22/2020,Property Solutions Acquisition,PSACU,EarlyBirdCapital,10,10.04,10.03,0,0.04,0.03,1,
7/17/2020,ALX Oncology Holdings,ALXO,Jefferies/ Credit Suisse/ Piper Sandler/ Cantor,18,36.5,30,0.67,18.5,12,3,
7/17/2020,Berkeley Lights,BLI,J.P. Morgan/ Morgan Stanley/ Cowen,22,51.03,65.45,1.98,29.03,43.45,3,
7/17/2020,Deerfield Healthcare Technology Acquisitions,DFHTU,Deutsche Bank Securities/ UBS Investment Bank,10,10.51,10.63,0.06,0.51,0.63,1,
7/17/2020,Pandion Therapeutics Holdco,PAND,Goldman Sachs/ Morgan Stanley/ SVB Leerink/ BMO Capital Markets,18,27,18.1,0.01,9,0.1,3,
7/16/2020,HPX Corp.,HPX.U,Credit Suisse,10,10.2,10.17,0.02,0.2,0.17,1,
7/16/2020,Relay Therapeutics,RLAY,J.P. Morgan/ Goldman Sachs/ Cowen/ Guggenheim Securities,20,35,35.05,0.75,15,15.05,3,
7/16/2020,Trean Insurance Group,TIG,J.P. Morgan/ Evercore ISI/ William Blair,15,17.05,15.51,0.03,2.05,0.51,3,
7/15/2020,D8 Holdings,DEH.U,UBS Investment Bank,10,10.05,10.03,0,0.05,0.03,1,
7/15/2020,GoHealth,GOCO,Goldman Sachs/ BofA Securities/ Morgan Stanley,21,25,19.13,-0.09,4,-1.87,3,
7/15/2020,Malacca Straits Acquisition (MLACU ) (u),MLCU,BTIG,10,10.1,10.04,0,0.1,0.04,1,
7/14/2020,nCino,NCNO,BofA Securities/ Barclays Capital/ KeyBanc Capital Markets/ SunTrust Robinson Humphrey,31,71,91.59,1.95,40,60.59,3,
7/13/2020,PTK Acquisition,PTK.U,Chardan,10,10.03,10.11,0.01,0.03,0.11,1,
7/10/2020,Nkarta,NKTX,Cowen/ Evercore ISI/ Stifel/ Mizuho Securities,18,54.75,47.99,1.67,36.75,29.99,3,
7/10/2020,Poseida Therapeutics,PSTX,BofA Securities/ Piper Sandler/ William Blair,16,17,15.35,-0.04,1,-0.65,3,
7/10/2020,Quhuo Limited,QH,Roth Capital Partners/ VALUABLE CAPITAL LIMITED/ Tiger Brokers,10,15.31,12.77,0.28,5.31,2.77,2,Missed
7/8/2020,BlueCity Holdings,BLCT, AMTD/ Loop Capital Markets/ Tiger Brokers/ Prime Number Capital/ R. F. Lafferty,16,20.45,23.43,0.46,4.45,7.43,0,
7/8/2020,Therapeutics Acquisition,TXAC,Jefferies,10,11.25,12.02,0.2,1.25,2.02,1,Missed
7/2/2020,Capstar Special Purpose Acquisition,CPSR.U,Citigroup/ UBS Investment Bank/ BTIG,10,10.16,10.22,0.02,0.16,0.22,1,
7/2/2020,Lemonade,LMND,Goldman Sachs/ Morgan Stanley/ Allen & Company/ Barclays Capital ,29,50.06,69.41,1.39,21.06,40.41,3,
7/1/2020,Dun & Bradstreet Holdings,DNB,Goldman Sachs/ BofA Securities,22,25,25.35,0.15,3,3.35,2,
7/1/2020,Panacea Acquisition,PANA.U,Cowen,10,10.85,11.3,0.13,0.85,1.3,1,
6/30/2020,GS Acquisition Holdings Corp II,GSAH.U,Goldman Sachs/ Citigroup,10,10.4,10.51,0.05,0.4,0.51,1,
6/26/2020,Agora,API,Morgan Stanley/ BofA Securities,20,45,50.5,1.53,25,30.5,2,
6/26/2020,Akouos,AKUS,BofA Securities/ Cowen/ Piper Sandler,17,22.26,22,0.29,5.26,5,3,
6/26/2020,Albertsons Companies,ACI,BofA Securities/ Goldman Sachs/J.P. Morgan/ Citigroup,16,15.5,15.45,-0.03,-0.5,-0.55,2,Missed
6/26/2020,Ebang International Holdings,EBON,AMTD/ Loop Capital Markets,5.23,4.6,5,-0.04,-0.63,-0.23,0,
6/26/2020,Fusion Acquisition,FUSE.U,Cantor,10,10.25,10.16,0.02,0.25,0.16,1,
6/26/2020,Fusion Pharmaceuticals,FUSN,Morgan Stanley/ Jefferies/ Cowen,17,18.5,17,0,1.5,0,3,
6/26/2020,Kensington Capital Acquisition,KCAC.U,UBS Investment Bank/ Stifel,10,10.05,10.05,0.01,0.05,0.05,1,
6/26/2020,PolyPid,PYPD,Barclays/ BMO Capital Markets,16,16,19,0.19,0,3,2,
6/24/2020,Brilliant Acquisition,BRLIU,EarlyBirdCapital,10,10.01,10.5,0.05,0.01,0.5,1,
6/19/2020,Forma Therapeutics Holdings,FMTX,Jefferies/ SVB Leerink/ Credit Suisse,20,40,39,0.95,20,19,3,
6/19/2020,Genetron Holdings,GTH,Credit Suisse/ CICC,16,16.15,16,0,0.15,0,3,Missed
6/19/2020,Progenity,PROG,Piper Sandler/ Wells Fargo Securities,15,15.11,13.12,-0.13,0.11,-1.88,3,Missed
6/19/2020,Repare Therapeutics,RPTX,Morgan Stanley/ Goldman Sachs/ Cowen/ Piper Sandler,20,32.05,30.8,0.54,12.05,10.8,3,
6/17/2020,Trebia Acquisition,TRE.U,Credit Suisse/ BofA Securities,10,10.46,10.34,0.03,0.46,0.34,1,
6/16/2020,Royalty Pharma plc,RPRX,J.P. Morgan/ Morgan Stanley/ BofA Securities/ Goldman Sachs/ Citigroup/ UBS Investment Bank,28,44,44.5,0.59,16,16.5,3,
6/12/2020,AZEK Company (The),AZEK,Barclays/ BofA Securities/ Goldman Sachs/ Jefferies,23,27.5,27.15,0.18,4.5,4.15,3,
6/12/2020,Burning Rock Biotech Ltd.,BNR,Morgan Stanley/ BofA Securities/ Cowen,16.5,22.8,24.63,0.49,6.3,8.13,3,
6/12/2020,Generation Bio,GBIO,J.P. Morgan/ Jefferies/ Cowen,19,22.15,24.69,0.3,3.15,5.69,3,
6/12/2020,Vaxcyte,PCVX,BofA Securities/ Jefferies/ Evercore ISI,16,20.8,26.15,0.63,4.8,10.15,3,
6/11/2020,Lantern Pharma,LTRN,ThinkEquity (a division of Fordham Financial Management) ,15,14.8,14.95,0,-0.2,-0.05,1,
6/10/2020,uCloudlink Group,UCL,I-Bankers Securities/ Valuable Capital Limited,18,22.5,17.24,-0.04,4.5,-0.76,1,
6/9/2020,Hudson Executive Investment,HECCU,Citigroup/ J.P. Morgan,10,10.19,10.25,0.03,0.19,0.25,3,
6/9/2020,Vroom,VRM,Goldman Sachs/ BofA Securities/ Allen & Company/ Wells Fargo Securities,22,40.25,47.9,1.18,18.25,25.9,4,
6/5/2020,Applied Molecular Transport (AMTI),AMTI,BofA Securities/Jefferies/ SVB Leerink,14,26,17.98,0.28,12,3.98,2,
6/5/2020,ARYA Sciences Acquisition Corp II,ARYBU,Jefferies/ Goldman Sachs,10,10.6,10.79,0.08,0.6,0.79,1,
6/5/2020,Dada Nexus Limited,DADA,Goldman Sachs (Asia)/ BofA Securities/ Jefferies,16,18.3,15.99,0,2.3,-0.01,2,
6/5/2020,Legend Biotech,LEGN,Morgan Stanley/ J.P. Morgan Securities/ Jefferies,23,37,37,0.61,14,14,2,
6/5/2020,Mountain Crest Acquisition,MCACU,Chardan,10,10.05,10.04,0,0.05,0.04,1,
6/5/2020,Shift4 Payments,FOUR,Citigroup/ Credit Suisse/ Goldman Sachs,23,33,33.54,0.46,10,10.54,3,
6/4/2020,ZoomInfo Technologies,ZI,J.P. Morgan/ Morgan Stanley/ Barclays/ Credit Suisse/ BofA Securities/ Deutsche Bank Securities/ RBC Capital Markets/ UBS Investment Ban/ Wells Fargo Securities,21,40,34,0.62,19,13,3,
6/3/2020,Pliant Therapeutics,PLRX,Citigroup/ Cowen/ Piper Sandler,16,25,21.3,0.33,9,5.3,3,
5/27/2020,Foley Trasimene Acquisition,WPF.U,Credit Suisse/ BofA Securities,10,10.15,10.18,0.02,0.15,0.18,1,
5/22/2020,Inari Medical,NRAI,BofA Securities/Morgan Stanley,19,41.3,42.51,1.24,22.3,23.51,3,
5/21/2020,Longview Acquisition,LGVW.U,Cowen/ UBS Investment Bank,10,10,10,0,0,0,1,
5/21/2020,SelectQuote,SLQT,Credit Suisse/ Morgan Stanley/ Evercore ISI/ RBC Capital Markets/ Barclays/ Citigroup/ Jefferies,20,26.2,27,0.35,6.2,7,3,
5/20/2020,B. Riley Principal Merger,BMRG.U,B. Riley FBR,10,10,10,0,0,0,1,
5/15/2020,ADC Therapeutics America SA,ADCI,Morgan Stanley/ BofA Securities/ Cowen and Company,19,30,29.65,0.56,11,10.65,1,
5/15/2020,Novus Capital,NOVSU,EarlyBirdCapital,10,9.97,9.95,-0.01,-0.03,-0.05,1,
5/14/2020,GigCapital3,GIK.U,Nomura/ Oppenheimer,10,9.9,9.91,-0.01,-0.1,-0.09,1,
5/14/2020,Jaws Acquisition,JWS.U,Credit Suisse,10,10,10.25,0.03,0,0.25,1,
5/8/2020,Ayala Pharmaceuticals,AYLA,Citigroup/ Jefferies,15,15.66,15.03,0,0.66,0.03,3,Missed
5/8/2020,China Liberal Education Holdings (CLEU),CLEU,Boustead Securities,6,5,4.85,-0.19,-1,-1.15,1,
5/8/2020,Kingsoft Cloud Holdings,KC,J.P. Morgan/ UBS Investment Bank/ Credit Suisse/ CICC ,17,20.37,23.84,0.4,3.37,6.84,2,
5/6/2020,Live Oak Acquisition,LOAK.U,Jefferies,10,10,9.88,-0.01,0,-0.12,1,
5/6/2020,Sustainable Opportunities Acquisition,SOAC.U,Citigroup,10,9.9,9.93,-0.01,-0.1,-0.07,1,
5/5/2020,Roth CH Acquisition,ROCHU,Roth Capital Partners/ Craig-Hallum Capital Group,10,9.95,9.94,-0.01,-0.05,-0.06,1,
5/1/2020,Collective Growth,CGROU,Cantor,10,10,9.96,0,0,-0.04,1,
5/1/2020,Lyra Therapeutics,LYRA,BofA Securities/ Jefferies/ William Blair,16,21,18.56,0.16,5,2.56,3,
4/30/2020,Fortress Value Acquisition (FVAC.U) (u),FVAC.U,Deutsche Bank Securities,10,10.05,10.06,0.01,0.05,0.06,1,
4/28/2020,Social Capital Hedosophia Holdings Corp. II,IPOB.U,Credit Suisse,10,10.15,10.12,0.01,0.15,0.12,1,
4/24/2020,CC Neuberger Principal Holdings I,PCPL.U,Goldman Sachs/ BofA Securities,10,10.05,10.06,0.01,0.05,0.06,1,
4/24/2020,Chardan Healthcare Acquisition 2,CHAQ.U,Chardan,10,10,9.98,0,0,-0.02,1,
4/24/2020,ORIC Pharmaceuticals,ORIC,J.P. Morgan/ Citigroup/ Jefferies/ Guggenheim Securities,16,26,25.77,0.61,10,9.77,3,
4/22/2020,Social Capital Hedosophia Holdings Corp. III,IPOC.U,Credit Suisse,10,10.08,10.07,0.01,0.08,0.07,1,
4/8/2020,Keros Therapeutics,KROS,Jefferies/ SVB Leerink/ Piper Sandler,16,20.85,20.08,0.26,4.85,4.08,2,
4/3/2020,Zentalis Pharmaceuticals,ZNTL,Morgan Stanley/ Jefferies/ SVB Leerink/ Guggenheim Securities ,18,25.2,23.2,0.29,7.2,5.2,1,Missed
4/1/2020,WiMi Hologram Cloud,WIMI,Benchmark Company/ Maxim Group/ China Merchants Securities (HK)/ AMTD Global Markets,5.5,6,5.5,0,0.5,0,0,
3/12/2020,IMARA,IMRA,Morgan Stanley/ Citigroup/ SVB Leerink,16,14,15,-0.06,-2,-1,1,
3/11/2020,DFP Healthcare Acquisitions,DFPHU,Deutsche Bank Securities,10,10.18,10.2,0.02,0.18,0.2,1,
3/6/2020,Flying Eagle Acquisition,FEAC.U,Goldman Sachs/ DNB Markets,10,10.45,10.4,0.04,0.45,0.4,1,
3/6/2020,LifeSci Acquisition,LSACU,Chardan,10,10.1,10.25,0.03,0.1,0.25,1,
3/3/2020,GFL Environmental Holdings,GFL,JPMorgan/ BMO Capital Markets/ Goldman Sachs/ RBC Capital Markets/ Scotiabank,19,17.5,16.8,-0.12,-1.5,-2.2,1,
2/28/2020,Passage BIO,PASG,J.P. Morgan/ Goldman Sachs/ Cowen,18,22.27,22.2,0.23,4.27,4.2,3,
2/24/2020,ZHONGCHAO,ZCMD,Network 1 Financial Securities,4,4.34,4,0,0.34,0,0,
2/21/2020,dMY Technology Group,DMYT.U,Goldman Sachs/ UBS Investment Bank,10,10.31,10.34,0.03,0.31,0.34,1,
2/20/2020,East Stone Acquisition,ESSCU,I-Bankers Securities,10,10.05,10.01,0,0.05,0.01,1,
2/14/2020,Churchill Capital Corp. III,CCXX.U,Citigroup/ Goldman Sachs,10,10.58,10.51,0.05,0.58,0.51,1,
2/14/2020,Newborn Acquisition,NBACU,Chardan,10,10.02,10.05,0.01,0.02,0.05,1,
2/13/2020,Yunhong International,ZGYHU,Maxim Group LLC,10,10.01,10,0,0.01,0,1,
2/13/2020,Muscle Maker,GRIL,Alexander Capital,5,4.7,3.86,-0.23,-0.3,-1.14,1,
2/13/2020,Revolution Medicines,RVMD,J.P. Morgan/ Cowen/ SVB Leerink/ Guggenheim Securities,17,28.21,28.9,0.7,11.21,11.9,3,
2/12/2020,Huize Holding Ltd.,HUIZ,Citigroup/ CICC,10.5,10.62,10,-0.05,0.12,-0.5,1,
2/11/2020,CITIC Capital Acquisition (CCAC.U) (u),CCAC.U,Credit Suisse,10,10.26,10.2,0.02,0.26,0.2,1,
2/11/2020,Greenrose Acquisition,GNRSU,Imperial Capital,10,10.02,10.07,0.01,0.02,0.07,1,
2/7/2020,NexPoint Real Estate Finance,NREF,Raymond James,19,16,18.8,-0.01,-3,-0.2,1,
2/7/2020,OneWater Marine,ONEW,Raymond James/ Baird/ SunTrust Robinson Humphrey,12,15.02,15.14,0.26,3.02,3.14,1,Missed
2/7/2020,Professional Holding,PFHD,"Stephens/ Keefe, Bruyette & Woods (A Stifel Company​)",18.5,19.31,19.55,0.06,0.81,1.05,0,
2/6/2020,Beam Therapeutics,BEAM,J.P. Morgan/ Jefferies/ Barclays,17,24,18.75,0.1,7,1.75,3,
2/6/2020,Casper Sleep,CSPR,Morgan Stanley/ Goldman Sachs/ Jefferies,12,14.5,13.5,0.13,2.5,1.5,1,
2/6/2020,PPD,PPD,Barclays/ J.P. Morgan/ Morgan Stanley/ Goldman Sachs/ BofA Securities/ Credit Suisse/ Jefferies/ UBS Investment Bank/ Citigroup/ Deutsche Bank Securities/ Evercore ISI/ HSBC/ Mizuho Securities/ Baird/ William Blair,27,31,30,0.11,4,3,3,
2/6/2020,Schrodinger,SDGR,Morgan Stanley/ BofA Securities/ Jefferies/ BMO Capital Markets,17,26,28.64,0.68,9,11.64,2,
2/4/2020,InterPrivate Acquisition,IPV.U,EarlyBirdCapital,10,10.09,10.1,0.01,0.09,0.1,1,
1/31/2020,1Life Healthcare,OWEM,J.P. Morgan/ Morgan Stanley,14,18,22.07,0.58,4,8.07,2,
1/31/2020,Arcutis Biotherapeutics,ARQT,Goldman Sachs/ Cowen/ Guggenheim Securities,17,23.05,21.8,0.28,6.05,4.8,2,
1/31/2020,Reynolds Consumer Products,REYN,Credit Suisse/ Goldman Sachs/ J.P. Morgan ,26,27.5,28.55,0.1,1.5,2.55,2,
1/29/2020,Annovis Bio,ANVS,ThinkEquity (a division of Fordham Financial Management ),6,6.63,9.59,0.6,0.63,3.59,1,Missed
1/29/2020,Black Diamond Therapeutics,BDTX,J.P. Morgan/ Jefferies/ Cowen,19,33,39.48,1.08,14,20.48,3,
1/28/2020,AnPac Bio-Medical Science,ANPC,WestPark Capital,12,12,11.25,-0.06,0,-0.75,1,
1/24/2020,Gores Holdings IV,GHIVU,Deutsche Bank Securities,10,10.52,10.45,0.05,0.52,0.45,1,
1/24/2020,SCVX Corp.,SCVXU,Credit Suisse,10,10.3,10.32,0.03,0.3,0.32,1,
1/17/2020,I-Mab,IMAB,Jefferies/ CICC,14,14.75,12.75,-0.09,0.75,-1.25,2,
1/17/2020,LIZHI,LIZI,Credit Suisse/ Citigroup,11,11.03,11.63,0.06,0.03,0.63,1,
1/17/2020,Phoenix Tree Holdings Ltd.,DNK,Citigroup/ Credit Suisse/ J.P. Morgan,13.5,13.5,13.5,0,0,0,1,
1/17/2020,Velocity Financial,VEL,Wells Fargo Securities/ Citigroup/ JMP Securities,13,13.85,13.51,0.04,0.85,0.51,1,
12/30/2019,Molecular Data,MKD,AMTD/ Fosun Hani/ Boustead Securities,5.38,6,5.46,0.01,0.62,0.08,0,
12/19/2019,Indonesia Energy,INDO,Maxim Group,11,11,10.5,-0.05,0,-0.5,1,
12/19/2019,Monopar Therapeutics,MNPR,JonesTrading,8,8.35,26.5,2.31,0.35,18.5,1,
12/13/2019,CIIG Merger,CIICU,UBS Investment Bank/ Barclays,10,10.02,10.18,0.02,0.02,0.18,1,
12/13/2019,Healthcare Merger,HCCOU,Cantor,10,10.16,10.3,0.03,0.16,0.3,1,
12/13/2019,OneConnect Financial Technology,OCFT,Morgan Stanley/ Goldman Sachs (Asia)/ J.P. Morgan/ Ping An of China Securities (Hong Kong),10,10.51,10,0,0.51,0,1,
12/13/2019,Sprout Social,SPT,Goldman Sachs/ Morgan Stanley,17,18.05,16.6,-0.02,1.05,-0.4,2,
12/12/2019,Bill.com Holdings,BILL,Goldman Sachs/ BofA Securities/ Jefferies/ KeyBanc Capital Markets,22,37.5,35.5,0.61,15.5,13.5,3,
12/12/2019,EHang Holdings,EH,Morgan Stanley/ Credit Suisse,12.5,12.55,12.49,0,0.05,-0.01,1,
12/11/2019,LIV Capital Acquisition,LIVKU,EarlyBirdCapital,10.01,10.01,10.02,0,0,0.01,1,
12/11/2019,XP Inc.,XP,Goldman Sachs/ J.P. Morgan/ Morgan Stanley/ XP Investments/ Itaú BBA,27,32.75,34.46,0.28,5.75,7.46,3,
12/5/2019,LMP Automotive Holdings,LMPX,ThinkEquity (a division of Fordham Financial Management),5,5,5.36,0.07,0,0.36,1,
11/26/2019,Alussa Energy Acquisition (ALUSU) (u),ALUS.U,BTIG,10,10.03,10.02,0,0.03,0.02,1,
11/22/2019,Alpine Income Property Trust,PINE,Raymond James/Baird/B. Riley FBR/BMO Capital Markets,19,19,19,0,0,0,1,
11/22/2019,CHP Merger,CHPMU,J.P. Morgan/ Credit Suisse/ Morgan Stanley,10,10.04,10.05,0.01,0.04,0.05,1,
11/22/2019,PropTech Acquisition,PTACU,Cantor,10,10.1,10.11,0.01,0.1,0.11,1,
11/21/2019,Canaan,CAN,Citigroup/ China Renaissance/ CMBI,9,12.6,8.99,0,3.6,-0.01,1,
11/21/2019,SiTime,SITM,Barclays/ Stifel,13,16.9,18.65,0.43,3.9,5.65,1,Missed
11/20/2019,Amplitude Healthcare Acquisition,AMHCU,BMO Capital Markets/ SVB Leerink,10,9.98,10,0,-0.02,0,1,
11/20/2019,Software Acquisition Group,SAQNU,B. Riley FBR,10,10.08,10.07,0.01,0.08,0.07,1,
11/19/2019,GreenVision Acquisition,GRNVU,I-Bankers Securities ,10,10.03,10.03,0,0.03,0.03,1,
11/12/2019,YayYo,YAYO,Aegis Capital/ WestPark Capital,4,4.05,3.55,-0.11,0.05,-0.45,1,
11/11/2019,89bio,ETNB,BofA Merrill Lynch/ SVB Leerink/ RBC Capital Markets,16,20,20.8,0.3,4,4.8,2,
11/8/2019,36Kr Holdings,KRKR,Credit Suisse/ CICC,14.5,12.58,13.06,-0.1,-1.92,-1.44,1,
11/8/2019,CNS Pharmaceuticals,CNSP,Benchmark,4,4.11,4.57,0.14,0.11,0.57,1,
11/8/2019,ECMOHO,MOHO,UBS Investment Bank/ CICC,10,10.1,10.1,0.01,0.1,0.1,1,
11/8/2019,Juniper Industrial Holdings (JIH.U) (u),JIH.U,UBS Investment Bank,10,10,10,0,0,0,1,
11/8/2019,Stable Road Acquisition,SRACU,Cantor,10,10.12,10.05,0.01,0.12,0.05,1,
11/8/2019,TELA Bio,TELA,Jefferies/ Piper Jaffray,13,13.75,13.35,0.03,0.75,0.35,2,
11/7/2019,Centogene B.V.,CNTG,SVB Leerink/ Evercore ISI,14,14.1,12.49,-0.11,0.1,-1.51,1,
11/7/2019,Galera Therapeutics,GRTX,BofA Merrill Lynch/ Citigroup/ Credit Suisse,12,12.5,12,0,0.5,0,2,
11/7/2019,LGL Systems Acquisition,DFNSU,Jefferies,10,10.03,10.04,0,0.03,0.04,1,
11/7/2019,Silvergate Capital,SI,"Barclays/ Keefe, Bruyette & Woods (A Stifel Company)",12,12.75,12.52,0.04,0.75,0.52,1,
11/5/2019,Merida Merger,MCMJU,EarlyBirdCapital,10,10,10,0,0,0,1,
11/5/2019,Q&K International Group,QK,Morgan Stanley/ CICC,17,17.35,17.64,0.04,0.35,0.64,1,
11/1/2019,Fangdd Network Group,DUO,Morgan Stanley/ Citigroup/ UBS/ CICC/ AMTD,13,13,13,0,0,0,1,
11/1/2019,FinServ Acquisition,FSRVU,Barclays/ Cantor,10,10.06,10.06,0.01,0.06,0.06,1,
11/1/2019,Osprey Technology Acquisition,SFTW.U,Credit Suisse,10,10,10,0,0,0,1,
10/31/2019,Oyster Point Pharma,OYST,J.P. Morgan/ Cowen/ Piper Jaffray,16,16.5,18.78,0.17,0.5,2.78,1,
10/31/2019,RAPT Therapeutics,RAPT,BMO Capital Markets/ Wells Fargo Securities/ UBS Investment Bank,12,12.25,13,0.08,0.25,1,1,
10/25/2019,Aesthetic Medical International Holdings Group,AIH,Cantor/ Haitong International/ Prime Number Capital,12,12.16,10.03,-0.16,0.16,-1.97,1,
10/25/2019,Cabaletta Bio,CABA,Morgan Stanley/ Cowen and Company/ Evercore Group,11,9,10,-0.09,-2,-1,1,
10/25/2019,Happiness Biology Technology Group,HAPP,Univest Securities,5.5,4.9,4.5,-0.18,-0.6,-1,1,
10/25/2019,Phathom Pharmaceuticals,PHAT,Goldman Sachs/ Jefferies/ Evercore ISI,19,22.5,24.6,0.29,3.5,5.6,1,Missed
10/25/2019,Progyny,PGNY,J.P. Morgan/ Goldman Sachs/ BofA Merrill Lynch,13,13.5,15.94,0.23,0.5,2.94,1,
10/25/2019,TFF Pharmaceuticals,TFFP,National Securities,5,5.19,5.07,0.01,0.19,0.07,1,
10/25/2019,Youdao,DAO,Citigroup/ Morgan Stanley,17,13.5,12.5,-0.26,-3.5,-4.5,1,
10/24/2019,BRP Group,BRP,J.P. Morgan/ BofA Merrill Lynch,14,17.38,16.37,0.17,3.38,2.37,2,
10/18/2019,Galileo Acquisition,GLEO.U,EarlyBirdCapital,10,10.06,10.04,0,0.06,0.04,1,
10/18/2019,Union Acquisition Corp. II,LATNU,Cantor,10,10.1,10.1,0.01,0.1,0.1,1,
10/17/2019,BellRing Brands,BRBR,Morgan Stanley/ Citigroup/ J.P. Morgan/ Goldman Sachs,14,15.5,16.5,0.18,1.5,2.5,1,Missed
10/11/2019,HBT Financial,HBT,"Keefe, Bruyette & Woods (A Stifel Company)/ J.P. Morgan",15,16.2,15.54,0.04,1.2,0.54,1,
10/11/2019,Vir Biotechnology,VIR,Goldman Sachs/ J.P. Morgan/ Cowen/ Barclays,20,16.15,14.02,-0.3,-3.85,-5.98,1,
10/10/2019,BioNTech SE,BNTX,J.P. Morgan/ BofA Merrill Lynch/ UBS Investment Bank/ SVB Leerink,15,16.5,14.24,-0.05,1.5,-0.76,1,
10/3/2019,Aprea Therapeutics,APRE,J.P. Morgan/ Morgan Stanley/ RBC Capital Markets,15,15.46,20.5,0.37,0.46,5.5,1,
10/3/2019,Frequency Therapeutics,FREQ,J.P. Morgan/ Goldman Sachs/ Cowen,14,11.2,13.7,-0.02,-2.8,-0.3,1,
10/3/2019,Viela Bio,VIE,Goldman Sachs/ Morgan Stanley/ Cowen,19,21.5,23.41,0.23,2.5,4.41,1,Missed
9/26/2019,Oportun Financial,OPRT,"Barclays/ J.P. Morgan/ Jefferies/ Keefe, Bruyette & Woods (A Stifel Company)",15,15.7,16.17,0.08,0.7,1.17,1,
