trade_date,issuer,symbol,lead_jointlead_managers,offer_price,opening_price,firstday_close,firstday_percent_pxchng,dollar_change_opening,dollar_change_close,star_ratings,performed
5/10/2017,Five Point Holdings,FPH,Citigroup/ J.P. Morgan,14,15.25,15.04,0.07,1.25,1.04,1,
5/9/2017,ENDRA Life Sciences,NDRAU,Dougherty & Company/Dawson James Securities,5,5.45,5.2,0.04,0.45,0.2,1,
5/9/2017,Guaranty Bancshares,GNTY,Sandler O’Neill + Partners/ Stephens,27,30,30.1,0.11,3,3.1,2,
5/5/2017,KKR Real Estate Finance Trust,KREF,Wells Fargo Securities/ Morgan Stanley/ KKR,20.5,21.01,22.13,0.08,0.51,1.63,1,Missed
5/5/2017,Ovid Therapeut,OVID,Citigroup/ Cowen and Company,15,14,12.25,-0.18,-1,-2.75,1,
5/5/2017,TPG Pace Energy Holdings,TPGEU,"Deutsche Bank Securities/ Goldman, Sachs",10,10.1,10.14,0.01,0.1,0.14,1,
5/4/2017,Biohaven Pharmaceutical Holding,BHVN,Morgan Stanley/ Piper Jaffray/ Barclays Capital,17,20.24,17.5,0.03,3.24,0.5,2,
5/4/2017,UroGen Pharma Ltd.,URGN,Jefferies/ Cowen and Company,13,13.28,13.98,0.08,0.28,0.98,2,
4/28/2017,Carvana,CVNA,Wells Fargo Securities/ BofA Merrill Lynch/ Citigroup/ Deutsche Bank Securities,15,13.71,11.1,-0.26,-1.29,-3.9,3,Missed
4/28/2017,China Rapid Finance Limited,XRF,Morgan Stanley/ Credit Suisse/ Jefferies,6,6.67,6.67,0.11,0.67,0.67,1,
4/28/2017,Cloudera,CLDR,Morgan Stanley/ J.P. Morga/ Allen & Company,15,17.87,18.1,0.21,2.87,3.1,3,
4/28/2017,Emerald Expositions Events,EEX,"BofA Merrill Lynch/ Barclays/ Goldman, Sachs",17,18.73,19.5,0.15,1.73,2.5,1,Missed
4/28/2017,NCS Multistage Holdings,NCSM,Credit Suisse/ Citigroup/ Wells Fargo Securities,17,20,19.5,0.15,3,2.5,1,Missed
4/28/2017,Zymeworks,ZYME,Citigroup/ Barclays/ Wells Fargo Securities/ Canaccord Genuity,13,13.5,13,0,0.5,0,3,Missed
4/27/2017,Floor & Decor Holdings,FND,BofA Merrill Lynch/ Barclays/ Credit Suisse / UBS Investment Bank,21,30.25,32.05,0.53,9.25,11.05,3,
4/21/2017,Select Energy Services,WTTR,Credit Suisse/ FBR/ Wells Fargo Securities/ BofA Merrill Lynch/ Citigroup/ J.P. Morgan,14,14.9,14.02,0,0.9,0.02,1,
4/13/2017,Cadence Bancorporation,CADE,"Goldman, Sachs/ J.P. MorganSandle/ O’Neill + Partners/ Keefe, Bruyette & Woods (A Stifel Company)",20,22.08,21.55,0.08,2.08,1.55,2,
4/13/2017,Tocagen,TOCA,Leerink Partners/ Evercore ISI/ Stifel,10,10.27,12.45,0.25,0.27,2.45,2,
4/13/2017,Warrior Met Coal,HCC,Credit Suisse/ Citigroup/ Morgan Stanley/ BMO Capital Markets/ RBC Capital Markets,19,17.5,18,-0.05,-1.5,-1,2,Missed
4/13/2017,Yext,YEXT,Morgan Stanley/ J.P. Morgan/ RBC Capital Markets,11,14.03,13.41,0.22,3.03,2.41,3,
4/12/2017,Netshoes (Cayman) Ltd.,NETS,"Goldman, Sachs/ J.P. Morgan/ Bradesco BBI/ Allen & Company/ Jefferies",18,16.32,16.1,-0.11,-1.68,-1.9,2,Missed
4/11/2017,Azul S.A.,AZUL,Citigroup/ Itaú BBA/ Deutsche Bank Securities,20.06,21.8,21.5,0.07,1.74,1.44,2,
4/11/2017,Vantage Energy Acquisition,VEACU,"Citigroup/ Credit Suisse/ Goldman, Sachs",10,10.1,10,0,0.1,0,1,
4/7/2017,Okta,OKTA,"Goldman, Sachs/ J.P. Morgan Securities/ Allen & Company",17,17,23.56,0.39,0,6.56,3,
4/6/2017,Schneider National,SNDR,Morgan Stanley/ UBS Investment Bank/ BofA Merrill Lynch,19,19.5,19,0,0.5,0,2,
4/6/2017,Elevate Credit,ELVT,UBS Securities/ Jefferies/ Stifel/ William Blair & Company,6.5,7,7.76,0.19,0.5,1.26,1,
4/5/2017,Hess Midstream Partners LP,MESM,"Goldman, Sachs/ Morgan Stanley",23,25.5,25.6,0.11,2.5,2.6,2,
3/30/2017,Kayne Anderson Acquisition,KAACU,Citigroup/ Deutsche Bank Securities/ Credit Suisse,10,10.09,10,0,0.09,0,1,
3/24/2017,Alteryx,AYX,"Goldman, Sachs/ J.P. Morgan",14,17.25,15.5,0.11,3.25,1.5,3,
3/24/2017,Silver Run Acquisition Corp II,SRUNU,Citigroup/ Credit Suisse/ Deutsche Bank Securities,10,10.21,10.36,0.04,0.21,0.36,1,
3/17/2017,MuleSoft,MULE,"Goldman, Sachs/ J.P. Morgan/ BoA Merrill Lynch",17,24.25,24.75,0.46,7.25,7.75,3,
3/16/2017,Canada Goose Holdings,GOOS,"CIBC Capital Markets/ Credit Suisse/ Goldman, Sachs/ RBC Capital Markets",12.78,18,16.08,0.26,5.22,3.3,3,
3/15/2017,Ardagh Group S.A.,ARD,"Citigroup/ Deutsche Bank Securities/ Goldman, Sachs/ Barclays/ Credit Suisse/ J.P. Morgan",19,21.96,22.91,0.21,2.96,3.91,1,Missed
3/10/2017,Presidio,PSDO,J.P. Morgan/ Citigroup,14,13.5,14.25,0.02,-0.5,0.25,2,Missed
3/10/2017,Matlin & Partners Acquisition,MPACU,Cantor Fitzgerald & Co.,10,10,10.01,0,0,0.01,1,
3/8/2017,J.JILL,JILL,BofA Merrill Lynch/Morgan Stanley/ Jefferies,13,12.85,12.65,-0.03,-0.15,-0.35,1,
3/8/2017,BeyondSpring,BYSI,Rodman & Renshaw (a Unit of H.C. Wainwright & Co.),20,20,16.8,-0.16,0,-3.2,0,No Call
3/2/2017,Snap,SNAP,Morgan Stanley/ Goldma Sachs/ J. P. Morgan/ Deutsche Bank Securities,17,23.71,24.48,0.44,6.71,7.48,3,
3/1/2017,Hamilton Lane,HLNE,J.P. Morgan/ Morgan Stanle,16,17.85,18.02,0.13,1.85,2.02,2,
2/28/2017,Deciphera Pharmaceuticals,DCPH,J.P. Morgan/ Piper Jaffray,17,20.05,17.65,0.04,3.05,0.65,2,
2/10/2017,Foundation Building Materials,FBM,Deutsche Bank Securities/ Barclays/ RBC Capital Markets/ Citigroup/ Baird,14,15.8,15.5,0.11,1.8,1.5,1,
2/10/2017,Sachem Capital,SACH,Joseph Gunnar,5,4.9,5.04,0.01,-0.1,0.04,1,
2/3/2017,"Kimbell Royalty Partners, LP",KRP,Raymond James/ RBC Capital Markets/ Stifel,18,18.11,20.64,0.15,0.11,2.64,1,
2/3/2017,Ramaco Resources,METC,Credit Suisse/ Jefferies/ BMO Capital Markets,13.5,14.55,13.55,0,1.05,0.05,2,
2/1/2017,Invitation Homes,INVH,Deutsche Bank Securities/ J.P. Morgan/ BofA Merrill Lynch/ Goldman Sachs/ Wells Fargo Securities/ Credit Suisse/ Morgan Stanley/ RBC Capital Market,20,20.15,20,0,0.15,0,1,
2/1/2017,Laureate Education,LAUR,Credit Suisse/ Morgan Stanley/ Barclays/ Macquarie Capital/ J.P. Morgan/ BMO Capital Markets/ Citigroup/ KKR/ Goldman Sachs,14,12.5,13.25,-0.05,-1.5,-0.75,1,
1/27/2017,Jounce Therapeutics,JNCE,J.P. Morgan/ Cowen and Company,16,18,17.25,0.08,2,1.25,2,
1/26/2017,AnaptysBio,ANAB,Credit Suisse/ Stifel,15,16,17,0.13,1,2,2,
1/20/2017,FinTech Acquisition Corp. II,FNTEU,Cantor Fitzgerald & Co.,10,10.1,10.05,0.01,0.1,0.05,1,
1/20/2017,Keane Group,FRAC,Citigroup/ Morgan Stanley/ BofA Merrill Lynch/ J.P. Morgan,19,22.18,21.65,0.14,3.18,2.65,3,
1/13/2017,Gores Holdings II,GSHTU,Deutsche Bank Securities,10,10.16,10.25,0.03,0.16,0.25,1,
12/16/2016,trivago N.V.,TRVG,J.P. Morgan/ Goldman Sachs/ Morgan Stanley,11,11.2,11.85,0.08,0.2,0.85,2,
12/14/2016,WildHorse Resource Development,WRD,Barclays/ BofA Merrill Lynch/ BMO Capital Markets/ Citigroup/ Wells Fargo Securities,15,15.7,15.06,0,0.7,0.06,2,
12/9/2016,"Ichor Holdings, Ltd.",ICHR,Deutsche Bank Securities/ Stifel,9,10.25,9.77,0.09,1.25,0.77,1,
12/8/2016,SenesTech,SNES,Roth Capital Partners,8,8.25,8.16,0.02,0.25,0.16,1,
12/7/2016,Polar Power,POLA,Roth Capital Partners/ Joseph Gunnar,7,7.55,9,0.29,0.55,2,1,
12/1/2016,Innovative Industrial Properties,IIPR,Ladenburg Thalmann/ Compass Point,20,20.25,19.15,-0.04,0.25,-0.85,1,
11/4/2016,Smart Sand,SND,Credit Suisse/ GoldmanSachs,11,10.3,10.99,0,-0.7,-0.01,2,
11/2/2016,GDS Holdings Ltd.,GDS,Credit Suisse/ J.P. Morgan,10,10,10.41,0.04,0,0.41,2,
10/28/2016,BlackLine,BL,Goldman Sachs/ J.P. Morgan,17,24.52,23.7,0.39,7.52,6.7,3,
10/28/2016,Quantenna Communications,QTNA,Morgan Stanley/ Barclays/ Deutsche Bank Securities,16,16.8,15.5,-0.03,0.8,-0.5,2,
10/27/2016,GTY Technology Holdings,GTYHU,Citigroup,10,10.04,10.05,0.01,0.04,0.05,1,
10/27/2016,Myovant Sciences Ltd.,MYOV,Citigroup/ Cowen and Company/ Evercore ISI/ Barclays,15,15,13.26,-0.12,0,-1.74,2,Missed
10/27/2016,ZTO Express (Cayman),ZTO,Morgan Stanley/ Goldman Sachs (Asia),19.5,18.4,16.57,-0.15,-1.1,-2.93,3,Missed
10/26/2016,Ra Pharmaceuticals,RARX,Credit Suisse/ Jefferies/ BMO Capital Markets,13,14.16,13,0,1.16,0,3,
10/20/2016,Forterra,FRTA,Goldman Sachs/ Citigroup/ Credit Suisse,18,16.61,16.5,-0.08,-1.39,-1.5,1,
10/20/2016,iRhythm Technologies,IRTC,J.P. Morgan/ Morgan Stanley,17,26.75,26.05,0.53,9.75,9.05,3,
10/19/2016,CRISPR Therapeutics AG,CRSP,Citigroup/ Piper Jaffray/ Barclays,14,15,14.09,0.01,1,0.09,1,
10/14/2016,Mammoth Energy Services,TUSK,Credit Suisse/ Barclays/ Simmons & Company International (Energy Specialists of Piper Jaffray),15,13.66,13.26,-0.12,-1.34,-1.74,1,
10/12/2016,Azure Power Global,AZRE,Barclays/ Credit Suisse,18,16.12,14.6,-0.19,-1.88,-3.4,1,
10/12/2016,Extraction Oil & Gas,XOG,Credit Suisse/ Barclays/ Goldman Sachs,19,22.75,21.85,0.15,3.75,2.85,2,
10/11/2016,Avista Healthcare Public Acquisition (AHPAU) (u),AHPAU,Credit Suisse,10,9.82,9.86,-0.01,-0.18,-0.14,1,
10/11/2016,AzurRx BioPharma,AZRX,WallachBeth Capital/ Network 1 Financial Securities,5.5,5.06,4.98,-0.09,-0.44,-0.52,1,
10/7/2016,Camping World Holdings,CWH,Goldman Sachs/ J.P. Morgan,22,23.75,22.5,0.02,1.75,0.5,3,
10/7/2016,Everspin Technologies,MRAM,Stifel/ Needham & Company,8,9.1,8.02,0,1.1,0.02,1,
10/6/2016,Advanced Disposal Services,ADSW,Deutsche Bank Securities/ Credit Suisse/ Barclays,18,20.5,20,0.11,2.5,2,1,Missed
10/6/2016,AquaVenture Holdings,WAAS,Citigroup/ Deutsche Bank Securities/ RBC Capital Markets,18,21,21.95,0.22,3,3.95,1,Missed
10/6/2016,Obalon Therapeutics,OBLN,UBS Investment Bank/ Canaccord Genuity/ Stifel,15,15.21,15,0,0.21,0,1,
9/30/2016,Nutanix,NTNX,Goldman Sachs/ Morgan Stanley/ J.P. Morgan/ RBC Capital Markets,16,26.5,37,1.31,10.5,21,3,
9/29/2016,Fulgent Genetics,FLGT,Credit Suisse/ Jefferies,9,9.21,9.18,0.02,0.21,0.18,1,
9/29/2016,Tabula Rasa HealthCare,TRHC,Wells Fargo Securities/ UBS Investment Bank/ Piper Jaffray,12,14.7,14.88,0.24,2.7,2.88,3,
9/23/2016,AC Immune SA,ACIU,Credit Suisse/ Jefferies/ Leerink Partners ,11,14.11,15.66,0.42,3.11,4.66,3,
9/23/2016,Gridsum,GSUM,Goldman Sachs (Asia)/ Citigroup,13,15.25,15.75,0.21,2.25,2.75,2,
9/23/2016,Valvoline,VVV,BofA Merrill Lynch/ Citigroup/ Morgan Stanley,22,24.1,23.1,0.05,2.1,1.1,3,
9/22/2016,CapStar Financial Holdings,CSTR,"Keefe, Bruyette & Woods/ Sandler O’Neill + Partners, L.P",15,16.56,15.9,0.06,1.56,0.9,2,
9/22/2016,e.l.f. Beauty,ELF,J.P. Morgan/ Morgan Stanley,17,24,26.5,0.56,7,9.5,3,
9/21/2016,Novan,NOVN,Piper Jaffray,11,14.4,18.1,0.65,3.4,7.1,3,
9/21/2016,The Trade Desk,TTD,Citigroup/ Jefferies/  RBC Capital Markets,18,28.75,30.1,0.67,10.75,12.1,3,
9/16/2016,Everbridge,EVBG,Credit Suisse/ BofA Merrill Lynch,12,12.3,15.25,0.27,0.3,3.25,1,
9/16/2016,FB Financial,FBK,"J.P. Morgan/ UBS/ Keefe, Bruyette & Woods (A Stifel Company)",19,21.15,20.75,0.09,2.15,1.75,2,
9/16/2016,Saban Capital Acquisition (SCACU) (u),SCACU,Deutsche Bank Securities/ Goldman Sachs,10,10.06,10.05,0.01,0.06,0.05,1,
9/15/2016,Noble Midstream Partners LP,NBLX,Barclays/ Baird/ J.P. Morgan/ BofA Merrill Lynch/ Citigroup/ Deutsche Bank Securities/ DNB Markets/ Mizuho Securities/ MUFG/ Wells Fargo Securities,22.5,26.5,26.2,0.16,4,3.7,2,
9/14/2016,M I Acquisitions,MACQU,Chardan Capital Markets,10,10,10,0,0,0,1,
8/19/2016,Stellar Acquisition III,STRU,Maxim Group LLC,10,10,9.97,0,0,-0.03,1,
8/12/2016,Airgain,AIRG,Northland Capital Markets,8,8,8,0,0,0,1,
8/11/2016,Medpace Holdings,MEDP,Jefferies/ Credit Suisse/ UBS Investment Bank/ Wells Fargo Securities,23,28.15,27.79,0.21,5.15,4.79,3,
8/11/2016,Protagonist Therapeutics,PTGX,Leerink Partners/ Barclays/ BMO Capital Markets,12,12,11.7,-0.03,0,-0.3,1,
8/5/2016,Atomera,ATMR,National Securities Corporation,7.5,8.13,8.08,0.08,0.63,0.58,1,
8/4/2016,At Home Group,HOME,BofA Merrill Lynch/ Goldman Sachs/ Jefferies/ Morgan Stanley,15,16.25,16.31,0.09,1.25,1.31,1,
8/4/2016,First Hawaiian,FHB,Goldman Sachs/ BofA Merrill Lynch/ BNP PARIBAS/ Barclays/ Credit Suisse/ Deutsche Bank Securities/ J.P. Morgan/ Citigroup/ Morgan Stanley/ UBS Investment Bank,23,24.2,24.25,0.05,1.2,1.25,3,
7/29/2016,Talend SA,TLND,Goldman Sachs/ J.P. Morgan/ Barclays/ Citigroup,18,27.66,25.5,0.42,9.66,7.5,4,
7/28/2016,Kinsale Capital Group,KNSL,J.P. Morgan/ William Blair/ RBC Capital Markets,16,18,18.35,0.15,2,2.35,2,
7/28/2016,Tactile Systems Technology,TCMD,Piper Jaffray/ William Blair/ Canaccord Genuity,10,10.35,11,0.1,0.35,1,1,
7/27/2016,Kadmon Holdings,KDMN,Citigroup/ Jefferies,12,11.55,9.7,-0.19,-0.45,-2.3,1,
7/22/2016,TPI Composites,TPIC,J.P. Morgan/ Morgan Stanley,11,13.56,13.56,0.23,2.56,2.56,1,
7/21/2016,IMPINJ,PI,RBC Capital Markets/ Pacific Crest Securities (a division of KeyBanc Capital Markets)/ Piper Jaffray,14,18,17.97,0.28,4,3.97,3,
7/21/2016,Patheon N.V.,PTHN,J.P. Morgan/ Morgan Stanley/ Jefferies/ UBS Investment Bank,21,25,24.99,0.19,4,3.99,3,
7/20/2016,Audentes Therapeutics,BOLD,BofA Merrill Lynch/ Cowen and Company/ Piper Jaffray,15,19,15.13,0.01,4,0.13,3,
7/15/2016,AdvancePierre Foods Holdings,APFH,Barclays/ Credit Suisse/ Morgan Stanley,21,23.5,24,0.14,2.5,3,2,
7/15/2016,Conyers Park Acquisition,CPAAU,Deutsche Bank Securities/ Goldman Sachs,10,10.05,10.21,0.02,0.05,0.21,1,
7/14/2016,LINE Corporation,LN,Morgan Stanley/ Nomura/ Goldman Sachs Japan/ J.P. Morgan,32.84,42,41.58,0.27,9.16,8.74,3,
7/8/2016,Monster Digital,MSDI,Axiom Capital Management/ WestPark Capital,4.5,4,3.68,-0.18,-0.5,-0.82,1,
7/7/2016,M III Acquisition,MIIIU,Cantor Fitzgerald & Co.,10,10,9.63,-0.04,0,-0.37,1,
6/23/2016,Twilio,TWLO,Goldman Sachs/ J.P. Morgan,15,23.99,28.79,0.92,8.99,13.79,3,
6/22/2016,Selecta Biosciences,SELB,UBS Investment Bank/ Stifel,14,15,14,0,1,0,1,
6/10/2016,Atkore International Group,ATKR,Credit Suisse/ Deutsche Bank Securities/ J.P. Morgan/ UBS Investment Bank,16,15.75,16,0,-0.25,0,1,
6/3/2016,Sensus Healthcare,SRTSU,Northland Capital Markets/ Neidiger Tucker Bruner,23,23.25,24.91,0.08,0.25,1.91,1,
6/2/2016,Clearside Biomedical,CLSD,Cowen and Company/ Stifel,7,8,7.25,0.04,1,0.25,1,
6/2/2016,Nant Health,NH,Jefferies/ Cowen and Company,14,16.11,18.59,0.33,2.11,4.59,1,Missed
5/26/2016,Cotiviti Holdings,COTV,Goldman Sachs/ J.P. Morgan,19,19.5,17.11,-0.1,0.5,-1.89,3,Missed
5/26/2016,GMS,GMS,Barclays/ Credit Suisse,21,22.5,21.91,0.04,1.5,0.91,1,
5/26/2016,Reata Pharmaceuticals,RETA,Citigroup/ Cowen and Company/ Piper Jaffray,11,11.06,13.7,0.25,0.06,2.7,1,
5/26/2016,US Foods Holding,USFD,Goldman Sachs/ Morgan Stanley/ J.P. Morgan,23,24.25,24.91,0.08,1.25,1.91,2,
5/24/2016,Midland States Bancorp,MSBI,"Sandler O'Neill + Partners/ Keefe, Bruyette & Woods (A Stifel Company)",22,22.06,21.9,0,0.06,-0.1,1,
5/20/2016,CF Corporation,CFCOU,Citigroup/ BofA Merrill Lynch/ Credit Suisse​,10,10.04,9.99,0,0.04,-0.01,1,
5/19/2016,Grupo Supervielle S.A.,SUPV,Morgan Stanley/ BofA Merrill Lynch,11,11.5,11.5,0.05,0.5,0.5,1,
5/19/2016,Merus B.V.,MRUS,Citigroup/ Jefferies,10,9.75,10.04,0,-0.25,0.04,1,
5/18/2016,PhaseRx,PZRX,Laidlaw & Company (UK) Ltd.,4,4.13,4.17,0.04,0.13,0.17,1,
5/13/2016,Acacia Communications,ACIA,Goldman Sachs/ BofA Merrill Lynch/ Deutsche Bank Securities,23,29,30.95,0.35,6,7.95,3,
5/13/2016,Oncobiologics,ONSIU,Jefferies/ Barclays,6,5.12,4.8,-0.2,-0.88,-1.2,1,
5/12/2016,SiteOne Landscape Supply,SITE,Deutsche Bank Securities/ Goldman Sachs/ UBS Investment Bank,21,25.9,26.67,0.27,4.9,5.67,1,Missed
5/6/2016,Intellia Therapeutics,NTLA,Credit Suisse/ Jefferies/ Leerink Partners,18,22,22.1,0.23,4,4.1,3,
5/6/2016,Spring Bank Pharmaceuticals,SBPH,Dawson James Securities,12,11.28,11.1,-0.08,-0.72,-0.9,1,
4/27/2016,Yintech Investment Holdings Limited,YIN,Jefferies,13.5,13.8,13.5,0,0.3,0,1,
4/22/2016,SecureWorks,SCWX,BofA Merrill Lynch/ Morgan Stanley/ Goldman Sachs/ J.P. Morgan,14,13.91,14,0,-0.09,0,1,
4/21/2016,American Renal Associates Holdings,ARA,BofA Merrill Lynch/ Barclays/ Goldman Sachs/ Wells Fargo Securities/ SunTrust Robinson Humphrey/Leerink Partners,22,26.5,26.5,0.2,4.5,4.5,2,
4/20/2016,MGM Growth Properties LLC,MGP,BofA Merrill Lynch/ J.P. Morgan/ Morgan Stanley/ Evercore ISI/ Barclays/ Citigroup/ Deutsche Bank Securities,21,22.75,22.01,0.05,1.75,1.01,2,
4/15/2016,Bats Global Markets,BATS,Morgan Stanley/ Citigroup,19,22.88,23,0.21,3.88,4,3,
4/7/2016,Aeglea BioTherapeutics,AGLE,UBS Investment Bank/ BMO Capital Markets/ Wells Fargo Securities,10,10.4,9.77,-0.02,0.4,-0.23,1,
3/22/2016,Corvus Pharmaceuticals,CRVS,Credit Suisse/ Cowen and Company,15,15,14.25,-0.05,0,-0.75,1,
3/11/2016,KLR Energy Acquisition,KLREU,EarlyBirdCapital,10,10,10,0,0,0,1,
3/3/2016,Jensyn Acquisition,JSYNU,Chardan Capital Markets,10,9.95,9.95,-0.01,-0.05,-0.05,1,
3/3/2016,Syndax Pharmaceuticals,SNDX,Morgan Stanley/ Citigroup,12,12.11,12.01,0,0.11,0.01,1,
2/24/2016,Silver Run Acquisition,SRAQU,Deutsche Bank Securities/ Citigroup/ Goldman Sachs,10,10.01,10.21,0.02,0.01,0.21,1,
2/11/2016,AveXis,AVXS,Goldman Sachs/ Jefferies,20,18.02,18.05,-0.1,-1.98,-1.95,2,Missed
2/11/2016,Proteostasis Therapeutics,PTI,Leerink Partners/ RBC Capital Markets,8,8,6.64,-0.17,0,-1.36,1,
2/3/2016,"BeiGene, Ltd.",BGNE,Goldman Sachs/ Morgan Stanley/ Cowen and Company,24,28.97,28.32,0.18,4.97,4.32,3,
2/3/2016,Editas Medicine,EDIT,Morgan Stanley/ J.P. Morgan,16,18,18.2,0.14,2,2.2,2,
12/18/2015,Yirendai Ltd.,YRD,Morgan Stanley/ Credit Suisse/ China Renaissance,10,10,9.1,-0.09,0,-0.9,1,
12/10/2015,Atlassian Corporation Plc,TEAM,Goldman Sachs/ Morgan Stanley,21,27.67,27.78,0.32,6.67,6.78,3,
11/20/2015,Duluth Holdings,DLTH,William Blair/ Baird/ Raymond James/ BMO Capital Markets,12,5.15,13.36,0.11,-6.85,1.36,1,
11/19/2015,Axsome Therapeutics,AXSM,Ladenburg Thalmann,9,9,9.07,0.01,0,0.07,1,
11/19/2015,Mimecast Ltd.,MIME,Goldman Sachs/ Barclays/ Jefferies/ RBC Capital Markets,10,11,10.1,0.01,1,0.1,3,
11/19/2015,Square,SQ,Goldman Sachs/ Morgan Stanley/ J.P. Morgan,9,11.2,13.07,0.45,2.2,4.07,1,
11/18/2015,Match Group,MTCH,J.P. Morgan/ Allen & Company/ BofA Merrill Lynch,12,13.5,14.74,0.23,1.5,2.74,1,Missed
11/13/2015,Instructure,INST,Morgan Stanley/ Goldman Sachs/ Jefferies,16,16,18,0.13,0,2,2,
11/13/2015,Xtera Communications,XCOM,Needham & Company/ Cowen and Company/ BMO Capital Markets,5,5.15,5,0,0.15,0,1,
11/11/2015,Advanced Accelerator Applications S.A.,AAAP,Citigroup/ Jefferies​ ​,16,18.5,24.5,0.53,2.5,8.5,1,Missed
11/11/2015,Equity Bancshares,EQBK,"Keefe, Bruyette & Woods (A Stifel Company)/ Stephens",22.5,24.25,23.89,0.06,1.75,1.39,3,
11/11/2015,Voyager Therapeutics,VYGR,Cowen and Company/ Piper Jaffray,14,15.1,17.75,0.27,1.1,3.75,1,
11/11/2015,Wave Life Sciences Pte Ltd.,WVE,Jefferies/ Leerink Partners,16,17.05,16,0,1.05,0,2,
10/29/2015,MyoKardia,MYOK,Credit Suisse/ Cowen and Company,10,11.08,10.53,0.05,1.08,0.53,1,
10/27/2015,Adesto Technologies,IOTS,Needham & Company/ Oppenheimer & Co.,5,5.6,5.9,0.18,0.6,0.9,1,
10/22/2015,Dimension Therapeutics,DMTX,Goldman Sachs/ Citigroup/ Wells Fargo Securities,13,12.6,10.8,-0.17,-0.4,-2.2,1,
10/21/2015,Ferrari N.V.,RACE,UBS Investment Bank/ BofA Merrill Lynch/ Santander,52,60,55,0.06,8,3,3,
10/21/2015,Multi Packaging Solutions International,MPSX,BofA Merrill Lynch/ Barclays/ Citigroup,13,13.25,15.83,0.22,0.25,2.83,1,
10/19/2015,American Farmland,AFCO,Deutsche Bank Securities/ Citigroup/ Raymond James/ RBC Capital Markets/ FBR,8,7,6.93,-0.13,-1,-1.07,1,
10/14/2015,Cerecor,CERCU,Maxim Group LLC,6.5,6.59,6.4,-0.02,0.09,-0.1,1,
10/14/2015,First Data,FDC,Citigroup/ Morgan Stanley/ BofA Merrill Lynch/ KKR/ Barclays/ Credit Suisse/ Deutsche Bank Securities/ Goldman Sachs/ HSBC/ Mizuho Securities/ PNC Capital Markets/ SunTrust Robinson Humphrey/ Wells Fargo Securities,16,16.39,15.75,-0.02,0.39,-0.25,1,
10/9/2015,CPI Card Group,PMTS,BMO Capital Markets/ Goldman Sachs/ CIBC,10,11,12.17,0.22,1,2.17,1,
10/8/2015,Allegiance Bancshares,ABTX,Baird/ Stephens,21,22.31,23.12,0.1,1.31,2.12,1,
10/8/2015,CytomX Therapeutics,CTMX,BofA Merrill Lynch/ Jefferies/ Cowen and Company,12,15.6,12.9,0.08,3.6,0.9,1,
10/7/2015,Aclaris Therapeutics,ACRS,Jefferies/ Citigroup,11,11.94,11.05,0,0.94,0.05,1,
10/7/2015,Pure Storage,PSTG,Morgan Stanley/ Goldman Sachs/ Barclays/ Allen & Company/ BofA Merrill Lynch,17,16.74,16.01,-0.06,-0.26,-0.99,3,Missed
10/2/2015,NovoCure,NVCR,J.P. Morgan/ Deutsche Bank Securities/ Evercore ISI/ Wells Fargo Securities,22,19.23,18.28,-0.17,-2.77,-3.72,1,
10/1/2015,Edge Therapeutics,EDGE,Leerink Partners/ Credit Suisse,11,11.6,12.94,0.18,0.6,1.94,1,
10/1/2015,Mirna Therapeutics,MIRN,Citigroup/ Leerink Partners,7,7.25,7.04,0.01,0.25,0.04,1,
10/1/2015,Performance Food Group,PFGC,Credit Suisse/ Barclays/ Wells Fargo Securities/ Morgan Stanley,19,19,19.2,0.01,0,0.2,1,
10/1/2015,Surgery Partners,SGRY,BofA Merrill Lynch/ Goldman Sachs/ Jefferies,19,17.45,18.11,-0.05,-1.55,-0.89,1,
9/18/2015,Nabriva Therapeutics AG,NBRV,Leerink Partners/ RBC Capital Markets,10.25,11.39,13.24,0.29,1.14,2.99,2,
9/18/2015,Penumbra,PEN,J.P. Morgan/ BofA Merrill Lynch,30,40,41.3,0.38,10,11.3,3,
9/17/2015,REGENXBIO Inc.,RGNX,Morgan Stanley/ BofA Merrill Lynch/ Piper Jaffray,22,30.26,30.45,0.38,8.26,8.45,3,
9/11/2015,Pace Holdings,PACEU,Deutsche Bank Securities/ Citigroup,10,10.1,10.11,0.01,0.1,0.11,1,
8/13/2015,Conifer Holdings,CNFR,BMO Capital Markets/ Raymond James,10.5,9.75,10.5,0,-0.75,0,1,
8/13/2015,E-compass Acquisition,ECACU,Cantor Fitzgerald,10,10.05,10.04,0,0.05,0.04,1,
8/13/2015,Houlihan Lokey,HLI,BofA Merrill Lynch/ Goldman Sachs,21,22.11,22.4,0.07,1.11,1.4,1,
8/12/2015,Global Blood Therapeutics,GBT,Morgan Stanley/ Goldman Sachs,20,34.65,43.11,1.16,14.65,23.11,3,
8/6/2015,Aimmune Therapeutics,AIMT,BofA Merrill Lynch/ Credit Suisse/ Piper Jaffray,16,17.5,24.1,0.51,1.5,8.1,3,
8/6/2015,Planet Fitness,PLNT,J.P. Morgan Securities Merrill Lynch/ Jefferies/ Credit Suisse Securities,16,14.5,16,0,-1.5,0,3,Missed
8/5/2015,Amplify Snack Brands,BETR,Goldman Sachs/ Jefferies/ Credit Suisse,18,17,16.14,-0.1,-1,-1.86,3,Missed
8/5/2015,Sunrun,RUN,Credit Suisse/ Goldman Sachs/ Morgan Stanley,14,13.06,10.77,-0.23,-0.94,-3.23,1,
8/5/2015,Zynerba Pharmeceuticals,ZYNE,Jefferies/ Piper Jaffray,14,18,16.25,0.16,4,2.25,3,
7/31/2015,TerraForm Global,GLBL,J.P. Morgan/ Barclays/ Citigroup/ Morgan Stanley,15,14,14,-0.07,-1,-1,1,
7/31/2015,Aqua Metals,AQMS,National Securities Corporation,5,6.5,5.35,0.07,1.5,0.35,1,
7/30/2015,Easterly Acquisition,EACQU,Citigroup,10,10,9.99,0,0,-0.01,1,
7/30/2015,Global Partner Acquisition,GPACU,Deutsche Bank Securities,10,10.01,10.03,0,0.01,0.03,1,
7/30/2015,vTv Therapeutics,VTV,Piper Jaffray/ Stifel,15,14,10.89,-0.27,-1,-4.11,2,Missed
7/28/2015,NantKwest,NK,BofA Merrill Lynch/ Citigroup/ Jefferies/ Piper Jaffray,25,37,34.64,0.39,12,9.64,3,
7/24/2015,JM Global Holding,WYIGU,Cantor Fitzgerald,10,10,10.06,0.01,0,0.06,1,
7/23/2015,Live Oak Bancshares,LOB,"Sandler O’Neill & Partners, L.P",17,18.5,19.07,0.12,1.5,2.07,2,
7/23/2015,Neos Therapeutics,NEOS,UBS Investment Bank/ BMO Capital Markets/ RBC Capital Markets,15,18.22,19.54,0.3,3.22,4.54,1,Missed
7/22/2015,Blue Buffalo Pet Products,BUFF,J.P. Morgan/ Citigroup,20,27,27.2,0.36,7,7.2,4,
7/17/2015,MCBC Holdings,MCFT,Baird/ Raymond James/ Wells Fargo Securities,15,15.5,15.92,0.06,0.5,0.92,2,
7/17/2015,Ooma,OOMA,Credit Suisse/ BofA Merrill Lynch,13,12.1,10.95,-0.16,-0.9,-2.05,1,
7/17/2015,Rapid7,RPD,Morgan Stanley/ Barclays,16,26.75,25.28,0.58,10.75,9.28,4,
7/16/2015,Chiasma,CHMA,Barclays/ Cowen and Company,16,20.99,20,0.25,4.99,4,3,
7/16/2015,Jupai Holdings,JP,Credit Suisse/ China Renaissance,10,10.41,11.08,0.11,0.41,1.08,1,
7/16/2015,Ollie's Bargain Outlet Holdings,OLLI,J.P. Morgan/ Jefferies/ BofA Merrill Lynch,16,21.27,21.15,0.32,5.27,5.15,1,
7/16/2015,ProNAi Therapeutics,DNAI,Jefferies/ BofA Merrill Lynch,17,28.68,30.8,0.81,11.68,13.8,3,
7/2/2015,Natera,NTRA,Morgan Stanle/ Cowen and Company/ Piper Jaffray,18,22.1,22.74,0.26,4.1,4.74,3,
7/1/2015,CNX Coal Resources LP,CNXC,BofA Merrill Lynch/ Wells Fargo Securities/ Jefferies / Scotia Howard Weil/ Citigroup/ Credit Suisse/ J.P. Morgan/ Evercore ISI / BB&T Capital Markets/ Goldman Sachs/ The Huntington Investment Company/ Stifel/ Nomura,15,15,15.41,0.03,0,0.41,1,
7/1/2015,ConforMIS,CFMS,J.P. Morgan/ Deutsche Bank Securities,15,18,19.25,0.28,3,4.25,3,
7/1/2015,Teladoc,TDOC,J.P. Morgan/ Deutsche Bank Securities,19,29.9,28.5,0.5,10.9,9.5,3,
7/1/2015,Unique Fabricating,UFAB,Roth Capital Partners/ Taglich Brothers,9.5,12.5,13.49,0.42,3,3.99,1,Missed
6/26/2015,Alarm.com Holdings,ALRM,Goldman Sachs/ Credit Suisse/ BofA Merrill Lynch,14,16.05,16.88,0.21,2.05,2.88,3,
6/26/2015,AppFolio,APPF,Morgan Stanley/ Credit Suisse,12,12.15,14.08,0.17,0.15,2.08,2,
6/26/2015,Seres Therapeutics,MCRB,Goldman Sachs/ BofA Merrill Lynch,18,31.36,51.4,1.86,13.36,33.4,3,
6/26/2015,Xactly,XTLY,J.P. Morgan/ Deutsche Bank Securities/ UBS Investment Bank,8,8,8.7,0.09,0,0.7,1,
6/26/2015,Yulong Eco-Materials,YECO,Axiom Capital Management/ Northland Capital Markets/ ViewTrade Securities,6.25,6.25,6.17,-0.01,0,-0.08,1,
6/25/2015,Catabasis Pharmaceuticals (CATB),CATB,Citigroup/ Cowen and Company,12,12.74,13,0.08,0.74,1,1,
6/25/2015,Gener8 Maritime,GNRT,Citigroup/ UBS/ Jefferies/ Evercore ISI,14,12.75,13.1,-0.06,-1.25,-0.9,1,
6/25/2015,Glaukos,GKOS,J.P. Morgan/ BofA Merrill Lynch/ Goldman Sachs,18,29.11,31.22,0.73,11.11,13.22,3,
6/25/2015,Lantheus Holdings,LNTH,Credit Suisse/ Jefferies/ RBC Capital Markets/ Wells Fargo Securities,14,16.22,11.56,-0.17,2.22,-2.44,1,
6/25/2015,Milacron Holdings,MCRN,BofA Merrill Lynch/ Barclays/ J.P. Morgan/ Baird/ Credit Suisse/ Goldman Sachs,20,19.5,19.58,-0.02,-0.5,-0.42,2,Missed
6/25/2015,TransUnion,TRU,Goldman Sachs/ J.P. Morgan/ BofA Merrill Lynch/ Deutsche Bank Securities/ RBC Capital Markets/ Wells Fargo Securities/ Credit Suisse,22.5,24.62,24.5,0.09,2.12,2,2,
6/24/2015,Ritter Pharmaceuticals,RTTR,Aegis Capital Corp,5,5,4.96,-0.01,0,-0.04,1,
6/19/2015,8point3 Energy Partners LP,CAFD,Goldman Sachs/ Citigroup/ Deutsche Bank Securities/ J.P. Morgan/ Credit Agricole CIB,21,20.8,20.49,-0.02,-0.2,-0.51,2,Missed
6/19/2015,Fogo de Chão,FOGO,Jefferies/ J.P. Morgan,20,25.24,25.75,0.29,5.24,5.75,4,
6/19/2015,MINDBODY,MB,Morgan Stanley/ Credit Suisse/ UBS Securities,14,16.22,11.56,-0.17,2.22,-2.44,3,
6/18/2015,Fitbit,FIT,Morgan Stanley/ Deutsche Bank Securities/ BofAMerrill Lynch,20,30.4,29.68,0.48,10.4,9.68,4,
6/18/2015,Univar,UNVR,Deutsche Bank Securities/ Goldman Sachs/ BofA Merrill Lynch,22,24.1,24.05,0.09,2.1,2.05,2,
6/17/2015,Nivalis Therapeutics,NVLS,Cowen and Company/ Stifel,14,16.5,14.92,0.07,2.5,0.92,2,
6/15/2015,Invuity,IVTY,Piper Jaffray/ Leerink Partners/ Stifel,12,12.75,14.92,0.24,0.75,2.92,1,
6/12/2015,Wingstop,WING,Morgan Stanley/ Jefferies/ Baird,19,30.5,30.59,0.61,11.5,11.59,3,
